"mirroring", "تناظر [مِرأوي]","في البيانيات الحاسوبية: إمكانُ إظهارِ صورةٍ مرأويّة لبيانيٍّ graphic، أيْ صورةٍ ناتجةٍ عن النسْخ التكراري مع الدوران للصورة الأصلية، أو صورةٍ ناتجةٍ عن انعكاس الصورة الأصلية حول أحد محاور التناظر.", https://scs.org.sy/scs/qamous/search?q=scs/qamous/showterm/2806, 4, 12
"mount", "ينصِّب","يُمكِّنُ من الربط بين نظام الملفات في الحاسوب وقرصٍ صُلب أو شريط. يُستخدَمُ هذا المصطلحُ غالباً لوصْف النفاذِ إلى الأقراص في حواسيب Macintosh أو الحواسيب التي تعمل تحت نظام التشغيل UNIX.", https://scs.org.sy/scs/qamous/search?q=scs/qamous/showterm/2807, 4, 12
"mouse pointer", "مؤشر الفأرة","عنصرٌ من الشاشةِ يَتغيّر موضعُه على الشاشة بتحريك المستخدِمِ للفأرة. واعتماداً على موضعِ مؤشر الفأرة والعمليةِ التي يجريها البرنامجُ الذي يتعامل مع الفأرة، تؤدِّي المِساحةُ من الشاشة التي يَظهر عليها مؤشرُ الفأرة دوْرَ هدفٍ لفعْلٍ يَتولَّد من نقْرِ أحد أزرار الفأرة.", https://scs.org.sy/scs/qamous/search?q=scs/qamous/showterm/2808, 4, 12
"mouse trails", "أثر [مسير] الفأرة","إحداثُ ظلٍّ كأنه ذيلٌ يَتبع مؤشرَ الفأرة على الشاشة، وذلك لتسهيل رؤيته. يفيد أثرُ الفأرة في الحواسيب الحمولة، والخفيفة، وخاصة في تلك التي لها مظاهير ذات مصفوفة غير نشطة، أو النماذج القديمة ذات الشاشات الأحادية اللون. ذلك أنّ المَيْزَ resolution المنخفضَ نسبياً وضعفَ التباين على مثل هذه الشاشات يُسهّلان فقدان مرأى مؤشر الفأرة الصغير.", https://scs.org.sy/scs/qamous/search?q=scs/qamous/showterm/2809, 4, 12
"move", "تحريك","أمرٌ (أو تعليمةٌ) لنقْلِ المعلومات من موضعٍ إلى آخر. واعتماداً على العملية الجارية، يمكِن لهذه التعليمة أن تؤثرَ في المعطيات في ذاكرة الحاسوب، أو في نصٍّ أو صورةٍ بيانية في ملفِّ معطيات. ففي البرمجة مثلاً: توجِبُ تعليمةُ move نقْلَ قيمةٍ واحدة من موضعِ ذاكرةٍ إلى آخر. وفي التطبيقات: يمكِن لأمر move أن يُعيدَ توضيعَ مقطعٍ من نصٍّ أو شكلٍ بيانيّ (كلياً أو جزئياً) من مكانٍ إلى آخرَ داخل الوثيقة. وعلى عكسِ إجراءِ النسْخِ (الذي يُكرِّرُ المعلومات)، فإنّ عمليةَ التحريكِ تعني أن المعلوماتِ قد حُذفتْ (أو قد تُحذَف) من موضعها الأصلي.", https://scs.org.sy/scs/qamous/search?q=scs/qamous/showterm/2810, 4, 12
"MP/M", "برنامج متعدد المهمات للحواسيب الصغرية","مختصر: Multi-tasking Program for Microcomputers. إصدارٌ متعدّدُ المهمات متعددُ المستخدِمين من نظام التشغيل CP/M.", https://scs.org.sy/scs/qamous/search?q=scs/qamous/showterm/2811, 4, 12
"MS-DOS", "[نظام تشغيل] MS-DOS","مختصر: Microsoft Disk Operating System. نظامُ تشغيلٍ لمهمةٍ واحدة ولِمُستخدِمٍ واحد مع واجهةِ أوامر سطرية، أُنجز عام 1981 لحواسيب IBM والمتوافقة معها. إن نظام MS-DOS كغيره من أنظمة التشغيل يديرُ عملياتٍ خارجية، مثل: دخل وخرج القرص، وتقبّل الفيديو، والتحكّم في لوحة المفاتيح، إضافةً إلى عدد من الوظائف الداخلية تتعلق بتنفيذ البرنامج وصيانة الملف.", https://scs.org.sy/scs/qamous/search?q=scs/qamous/showterm/2812, 4, 12
"MS-DOS mode", "نمط MS-DOS","مَظْرفٌ shell افتراضيٌّ في نظام DOS، تُقلَّد فيه بيئة DOS في أنظمة ذات 32 بتّ كما هو الحال في Windows 95.", https://scs.org.sy/scs/qamous/search?q=scs/qamous/showterm/2813, 4, 12
"MS-DOS shell", "مَظْرف MS-DOS","بيئةٌ مَظرفيّةٌ تَعتمد على علامةِ تَقبّل الأوامر السطرية، التي تَسمح للمستخدِم بالتفاعل مع نظام DOS أو مُحاكٍ له.", https://scs.org.sy/scs/qamous/search?q=scs/qamous/showterm/2814, 4, 12
"MultiFinder", "[واجهة] MultiFinder","إصدارٌ من Apple Macintosh Finder يجعله متعددَ المهمات. يَسمح استخدامُه الأوليّ بمكوث عدةِ تطبيقات في الذاكرة في الوقت نفسه. وبنقْرةٍ واحدة للفأرة يمكِن الانتقالُ ونسْخُ المعلومات بين تطبيقٍ وآخر. أما إذا كان التطبيقُ النشط في لحظةٍ ما يَسمح بتعدديةٍ حقيقية للمهمات، فيمكِن معالجةُ المهمات الخلفية.", https://scs.org.sy/scs/qamous/search?q=scs/qamous/showterm/2815, 4, 12
"multitasking", "تعدد المهمات","نمطُ عمليةٍ يقدّمها نظامُ التشغيل بحيث يَعمل الحاسوبُ على أكثر من مهمة في وقتٍ واحد.", https://scs.org.sy/scs/qamous/search?q=scs/qamous/showterm/2816, 4, 12
"multithreading", "1 نيسبة متعددة ؛ 2 تعدد المسالك","1- تنفيذُ عدة إجرائياتٍ في تتالٍ سريع (تعدد المهمات) ضمن برنامج وحيد. 2- في تداول المعطيات: تقنيةٌ تحوي فيها العُقَدُ (في بنية شجرة المعطيات) مؤشراتٍ لعُقدٍ عليا لتجعل اجتياز البنية أكثر فعالية.", https://scs.org.sy/scs/qamous/search?q=scs/qamous/showterm/2817, 4, 12
"multiuser system", "نظام متعدد المستخدمين","أيُّ نظامٍ حاسوبي يمكِن أن يستعملَه أكثرُ من شخص. ومع أن الحاسوبَ الصغري الذي يتقاسم العمل فيه عدةُ أشخاص يُعدّ نظاماً متعددَ المستخدِمين، فإن استخدامَ هذا المصطلح مخصّصٌ عموماً للآلات التي يُمكِن لمجموعة من الناس النفاذُ إليها معاً عن طريق تسهيلات اتصالية أو مطاريف شبكة.", https://scs.org.sy/scs/qamous/search?q=scs/qamous/showterm/2818, 4, 12
"mutual exclusion", "استبعاد متبادل","تقنيةٌ برمجيةٌ تَضمَن أنّ برنامجاً واحداً فقط (أو مَساقاً routine واحداً) يَحقّ له النفاذُ إلى بعض الموارد، (كموضع في الذاكرة، أو منفذ دخل/خرج، أو ملف) في الوقت الواحد. ويجري هذا غالباً باستعمال التومئة semaphore؛ وهي راياتٌ flags تُستعمَلُ في البرنامج لتنسيق الأفعال بين أكثر من برنامج أو مساق.", https://scs.org.sy/scs/qamous/search?q=scs/qamous/showterm/2819, 4, 12
"native file format", "مصاغة ملف أصيلة","مَصَاغَةُ تطبيقٍ تُستعمَلُ داخلياً لمعالجة المعطيات. يجب على التطبيق تحويل الملفات ذات المصاغات الأخرى إلى مصاغة أصيلة قبل أن تستطيع التعامل معها. فمثلاً، قد يتعرَّف معالجُ نصوصٍ ملفات نصيّة بمصاغة ASCII، ولكنه يحوِّل هذه الملفات إلى مصاغته الأصيلة قبل إظهارها.", https://scs.org.sy/scs/qamous/search?q=scs/qamous/showterm/2820, 4, 12
"NetBSD", "[نظام] NetBSD","إصدارٌ مجاني لنظام التشغيل BSD UNIX المُطوَّر بجهودٍ طوعية. إن NetBSD ذو تشغيلية بينية مرتفعة، ويَعمل على العديد من المنصات العتادية، وهو متوافقٌ تقريباً مع POSIX.", https://scs.org.sy/scs/qamous/search?q=scs/qamous/showterm/2821, 4, 12
"NetPC", "[توصيف] NetPC","توصيفٌ لمنصةٍ حاسوبية أوجدتْه شركتا Microsoft وIntel في عام 1996 للأنظمة التي تَستخدِمُ برامج تطبيقات قائمة على مُخدِّم Windows NT، بدلاً من التطبيقات القائمة على حاسوب الزبون.", https://scs.org.sy/scs/qamous/search?q=scs/qamous/showterm/2822, 4, 12
"NetWare", "[نظام] NetWare","نظامُ تشغيلٍ لشبكات Novell المحلية. يمكِن تشغيلُ هذا النظام على منصات عتادية مختلفة وتشكيلات شبكية مختلفة.", https://scs.org.sy/scs/qamous/search?q=scs/qamous/showterm/2823, 4, 12
"Network File System", "نظام ملفات شبكية","مختصره: NFS. نظامُ ملفاتٍ موزَّعٌ طوَّرتْه شركةُ Sun Microsystems يَسمح لمستخدِمي محطات العمل (التي تعمل على Windows NT وUNIX) بالنفاذ إلى الملفات والأدلة على شبكة كما لو كانت شبكةً محلية.", https://scs.org.sy/scs/qamous/search?q=scs/qamous/showterm/2824, 4, 12
"Newton OS", "نظام تشغيل Newton","نظامُ التشغيل الذي يتحكَّم في المساعِدِ الرقْميّ الشخصي لحاسوب Newton من Apple.", https://scs.org.sy/scs/qamous/search?q=scs/qamous/showterm/2825, 4, 12
"NeXT", "[شركة] NeXT","منتَجٌ لشركة NeXT للحواسيب (سميت فيما بعد شركة برمجيات NeXT)، وهي شركةٌ تُصنِّع الحواسيبَ وتُطوِّر البرمجيات، أسَّسها Steven Jobs عام 1985. ثم اشترتْها شركةُ Apple للحواسيب عام 1997.", https://scs.org.sy/scs/qamous/search?q=scs/qamous/showterm/2826, 4, 12
"NTFS", "NT نظام ملفات","نظامُ ملفاتٍ متقدم صُمِّم بوجهٍ خاص لنظام التشغيل Windows NT، يَتقبَّل الأسماءَ الطويلةَ للملفات، ويتحكَّم في أمن النفاذ، ويَستعيد ملفات النظام، ويُعدّ من وسائط التخزين الكبيرة جداً، وله مزايا متنوعة للنظام الفرعي Windows NT POSIX. ويتقبّل أيضاً تطبيقات غرضية التوجه، وذلك بمعالجة الملفات على أنها أغراض ذات واصفات عرّفها المستخدِم، وخصائص عرّفها النظام.", https://scs.org.sy/scs/qamous/search?q=scs/qamous/showterm/2827, 4, 12
"nuke", "1 يمحو ؛ 2 يوقف","1- يمحو ملفاً، أو دليلاً، أو كاملَ القرص الصُّلب. 2- يوقفُ إجرائيةً حاسوبية في نظام تشغيل، أو تطبيق، أو برنامج.", https://scs.org.sy/scs/qamous/search?q=scs/qamous/showterm/2828, 4, 12
"object computer", "حاسوبٌ غرضٌ","الحاسوبُ الذي يكون هدفاً لمحاولة اتصالات معيّنة.", https://scs.org.sy/scs/qamous/search?q=scs/qamous/showterm/2829, 4, 12
"object-oriented operating system", "نظام تشغيل غرضي التوجّه","نظامُ تشغيلٍ يَعتمد على الأغراض، ومُصمَّمٌ لتسهيل التطوير البرمجي من طرف ثالث، مُستخدماً التصميمَ الغرضي التوجّه.", https://scs.org.sy/scs/qamous/search?q=scs/qamous/showterm/2830, 4, 12
"offline", "1 مفصول [عن الخط] ؛ 2 مفصول [عن الشبكة]","1- في إطار تجهيزة حاسوب أو برنامج: عدمُ القدرةِ على الاتصال بحاسوب، أو التحكّم فيه بواسطة حاسوب آخر.", https://scs.org.sy/scs/qamous/search?q=scs/qamous/showterm/2831, 4, 12
"offline storage", "وسط خزن مفصول [عن الخط]","مَوْردُ تخزينٍ (قرص صُلب مثلاً) غيرُ متاحٍ حالياً للنظام.", https://scs.org.sy/scs/qamous/search?q=scs/qamous/showterm/2832, 4, 12
"online", "1 موصول [إلى الخط] ؛ 2 موصول [إلى الشبكة] ؛ 3 موصول [إلى الشبكة، الخ...] ؛ 4 قابل للوصل [إلى الشبكة، الخ...]","1- في إطار تجهيزة حوسبة أو برنامج: مفعَّلٌ وجاهزٌ للتشغيل، وقادرٌ على الاتصال بحاسوب أو مسيطَر عليه من قبل حاسوب.", https://scs.org.sy/scs/qamous/search?q=scs/qamous/showterm/2833, 4, 12
"open file", "ملف مفتوح","ملفٌّ يمكِن قراءتُه أو كتابتُه أو كلا الأمرين معاً. يجب على البرنامج فتْحُ الملفِّ قبل استخدام محتوياته، ويجب إغلاقُه قبل تصديره.", https://scs.org.sy/scs/qamous/search?q=scs/qamous/showterm/2834, 4, 12
"open", "يفتح","يَجعلُ غرضاً (ملف مثلاً) قابلاً للنفاذ إليه.", https://scs.org.sy/scs/qamous/search?q=scs/qamous/showterm/2835, 4, 12
"operating system", "نظام تشغيل","مختصره: OS. مجموعةُ البرمجياتِ التي تتحكّم في تحصيص واستخدامات الموارد العتادية كالذاكرة، ووقت وحدة المعالجة المركزية CPU، ومِساحة القرص، والتجهيزات الطرفية. يُعدّ نظامُ التشغيلِ الأساسَ الذي تُبنى عليه التطبيقات. من أنظمة التشغيل الشائعة Windows 95، و Windows NT، وMacOS، وUNIX.", https://scs.org.sy/scs/qamous/search?q=scs/qamous/showterm/2836, 4, 12
"operations research", "بحوث العمليات","استعمالُ النُّهوجِ الرياضية والعلمية لتحليل وتحسين مردود العمل، والإدارة، والحكْم، والمجالات الأخرى. طُوِّر في بداية الحرب العالمية الثانية، وكان يُستعمَلُ في البداية لتحسين العمليات العسكرية خلال الحرب. ثم انتشر فيما بعد إلى الأعمال التجارية والصناعة لتحليل الأنظمة والإجراءات ودراسة أجزائها والتفاعلات فيما بينها، بغية تحسين الأداء الإجمالي. تتضمّن بحوثُ العمليات استعمالَ طريقة المسار الحرج، والإحصاء، والاحتمال، ونظرية المعلومات.", https://scs.org.sy/scs/qamous/search?q=scs/qamous/showterm/2837, 4, 12
"operator", "1 مؤثِّر ؛ 2 مشغّل","1- في البرمجة والتطبيقات الحاسوبية: رمزٌ أو محرفٌ يدل على عمليةٍ تُنفَّذ على عنصرٍ أو أكثر.", https://scs.org.sy/scs/qamous/search?q=scs/qamous/showterm/2838, 4, 12
"OS/2", "[نظام التشغيل] OS/2","نظامُ تشغيلٍ متعدِّدُ المهمات، ذو ذاكرة افتراضية ونمط محميّ، خاص بالحواسيب الشخصية ذوات المعالجات: 80286، و 80386، و i486 و Pentium. يمكِن لنظام OS/2 أن يَتقبّلَ معظمَ تطبيقات MS-DOS، وأن يَقرأ جميعَ أقراصه. تتضمّن عدةُ أنظمةٍ فرعيةٍ مهمةٍ من OS/2 إدارةَ عرْضٍ توفِّر واجهةَ مستخدِمٍ بيانية، وتتضمّن برنامجَ إدارةِ شبكةٍ محلية LAN توفر تسهيلات شبكية. طُوِّر OS/2 في البداية كمشروعٍ مشترك بين Microsoft وIBM، ولكنه حالياً أحدُ منتجات IBM.", https://scs.org.sy/scs/qamous/search?q=scs/qamous/showterm/2839, 4, 12
"output buffer", "صِوان خرج","جزءٌ من الذاكرة، مخصّصٌ لتخزين مؤقّت للمعلومات، وتُتركُ الذاكرةُ الرئيسية للتخزين، أو الإظهار، أو الطباعة، أو النقل.", https://scs.org.sy/scs/qamous/search?q=scs/qamous/showterm/2840, 4, 12
"output", "خرج","نتائجُ المعالَجةِ المرسَلةُ إلى الشاشة أو الطابعة، أو المُخزَّنةُ في قرص باعتبارها ملفاً، أو المُرسَلةُ إلى حاسوب آخر على الشبكة.", https://scs.org.sy/scs/qamous/search?q=scs/qamous/showterm/2841, 4, 12
"override", "يُبطل","يَمنعُ حدوثَ شيءٍ في برنامجٍ أو في نظام تشغيل، أو يَستهلُّ استجابةً أخرى. ففي كثير من الأحيان، يمكِن لمستخدِمٍ أن يُبطلَ (ومن ثم يحبط) إجراءَ فرزٍ طويل، في برنامج قاعدة معطيات بأن يضغط زرَّ الخلوص Escape key.", https://scs.org.sy/scs/qamous/search?q=scs/qamous/showterm/2842, 4, 12
"p-system", "نظامٌ مفترَض","نظامُ تشغيلٍ قائمٌ على آلةٍ مفترَضة مُنجَّزةٍ برمجياً. إن أيَّ برنامجٍ مكتوب لنظامٍ مفترَض يَكون محمولاً أكثرَ من البرنامج المكتوب لنظام تشغيل يَعتمد على الآلة.", https://scs.org.sy/scs/qamous/search?q=scs/qamous/showterm/2843, 4, 12
"pad character", "محرف حشو","في إدخال المعطيات وتخزينها: محرفٌ إضافيٌّ تُحشّى به الفراغاتُ الزائدة في كتلةٍ مُعرَّفة سلفاً ذات طولٍ محدَّد، مثل حقل مثبت الطول.", https://scs.org.sy/scs/qamous/search?q=scs/qamous/showterm/2844, 4, 12
"padding", "حشو","في تخزين المعطيات: إضافةُ بتّ أو أكثر (عادة أصفار) إلى كتلة معطيات لملْئِها، أو لقسْرِ بتّات المعطيات الفعلية على وضعٍ معيّن، أو لمنْعِ المعطيات من النسْخ التكراري لأشكال نمطية من بتّات ذات معنى معرَّف، مثل أمر مضمّن.", https://scs.org.sy/scs/qamous/search?q=scs/qamous/showterm/2845, 4, 12
"page", "1 صفحة ؛ 2 صفحة ؛ 3 صفحة","1- في معالجة النصوص: صفحةٌ من نصٍّ خاضعةٌ لمواصفات الإصَاغة formatting، مثل عرض الهوامش وعدد الأعمدة. 2- كتلةُ ذاكرةٍ ثابتة الحجم. فالصفحةُ عندما تُستعمَلُ في سياق نظام الذاكرة الصفحاتية، هي كتلة من الذاكرة يمكِن أن يُغيَّرَ عنوانُها الحقيقي بعتاديات التقابل.", https://scs.org.sy/scs/qamous/search?q=scs/qamous/showterm/2846, 4, 12
"page fault", "خطأ صفحة [الذاكرة]","المقاطعةُ التي تَحدثُ عندما تحاول برمجيةٌ القراءةَ من (أو الكتابةَ في) موضعِ ذاكرةٍ افتراضية وُضعَتْ عليه علامة 'غير موجود not present'. تَحتفظُ عتادياتُ الطباقِ mapping لنظامِ الذاكرةِ الافتراضية بمعلوماتٍ عن حالة كلِّ صفحةٍ في فضاء العنْونة الافتراضية. تُقابَلُ الصفحةُ على عنوانٍ حقيقي، أو تَكون غير موجودة في الذاكرة المادية. عند اكتشاف عملية قراءة (أو كتابة في) عنوانٍ افتراضي غير مُقابَل، تَقوم عتادياتُ إدارة الذاكرة بتوليد مقاطعة خطأ صفحة. يجب على نظام التشغيل الاستجابةُ لخطأ الصفحات بإبدالِ swapping معطياتِ الصفحة وتَحديثِ المعلومات عن الحالة لدى وحدة إدارة الذاكرة.", https://scs.org.sy/scs/qamous/search?q=scs/qamous/showterm/2847, 4, 12
"page frame", "إطار صفحة [ذاكرة]","عنوانٌ حقيقيٌّ يمكِن مقابلتُهُ mapped بذاكرةٍ افتراضية. ففي نظامٍ ذي صفحاتِ بحجم 4096 بايت، يُقابِلُ إطارُ الصفحة 0 العناوينَ الحقيقةَ من 0 حتى 4095.", https://scs.org.sy/scs/qamous/search?q=scs/qamous/showterm/2848, 4, 12
"paged memory management unit", "وحدة إدارة الذاكرة الصفحيّة","مختصره: PMMU. وحدةٌ عتاديةٌ تُنفِّذ المهمّاتِ المتعلقةَ بالنفاذ إلى الذاكرة وإدارتها، وتَستخدمها تطبيقاتٌ مختلفةٌ أو نظم تشغيل بذاكرة افتراضية.", https://scs.org.sy/scs/qamous/search?q=scs/qamous/showterm/2849, 4, 12
"paging", "تقطيع صفحيّ","تقنيةٌ مستخدَمةٌ في تَنجيزِ الذاكرةِ الافتراضية. يُقسَمُ فضاءُ العنونة الافتراضي إلى عددٍ من الكتلِ blocks الثابتةِ الحجم، تسمّى 'صفحات pages'، وكلُّ صفحةٍ يمكِن أن تُقابَلَ mapped على أيِّ عنوانٍ حقيقي متوفّر في النظام. تُنجِزُ عتادياتٌ خاصةٌ بإدارةِ الذاكرةِ MMU أو PMMU تحويلَ العنوانِ الافتراضي إلى عنوان حقيقي.", https://scs.org.sy/scs/qamous/search?q=scs/qamous/showterm/2850, 4, 12
"parallel access", "نفاذ متواز","قابليةُ تخزينِ (أو استحضار) البتّاتِ المكوِّنةِ لوحدة معلومات، كبايتٍ أو كلمةٍ (عموماً بايتَين) في وقت واحد.", https://scs.org.sy/scs/qamous/search?q=scs/qamous/showterm/2851, 4, 12
"parent/child", "1 أب/ابن ؛ 2 أب/ابن","1- تَخصُّ أو تُكوِّنُ العلاقةَ بين إجرائيات تُنفَّذ في بيئةٍ متعددة المهمات، تَقوم فيها إجرائيةُ أبٍ باستدعاء إجرائيةِ ابن، ثم تُعلّق عملياتها الخاصة بها حتى إحباط الإجرائية الابن أو انتهائها. 2- تَخصُّ أو تُكوِّنُ العلاقةَ بين العُقدِ في بنيةِ معطياتٍ شجريّة، يَكون فيها الأبُ أقرب إلى الجذر بمرتبةٍ واحدة من الابن (أي أعلى منه بمرتبة واحدة).", https://scs.org.sy/scs/qamous/search?q=scs/qamous/showterm/2852, 4, 12
"park", "يوقف [الرأس]","يَضَعُ رأسَ القراءة/الكتابة فوقَ جزءٍ من القرص لا يحوي معلومات (لذلك لا يؤدي إلى تخريبه)، أو خارجَ سطحِ القرص قبل إيقاف المِسْوَق drive، وبالأخص عند التحضير لنقلِ القرص. يمكِن إجراءُ الإيقاف يدوياً، أو آلياً، أو (عادةً) بواسطة نافعةٍ utility للقرص.", https://scs.org.sy/scs/qamous/search?q=scs/qamous/showterm/2853, 4, 12
"partition", "1 تقسيمة ؛ 2 تقسيمة","1- جزءٌ متمايزٌ منطقياً من ذاكرة أو تجهيزةِ تخزين يَعمل كما لو كان وحدةً مستقلةً مادياً. 2- في برمجة قواعد المعطيات: مجموعةٌ فرعيةٌ من جدول من قاعدة معطيات أو ملفّ.", https://scs.org.sy/scs/qamous/search?q=scs/qamous/showterm/2854, 4, 12
"patch", "نقيلة","جزءٌ من رِمَازٍ غرضيٍّ object code يُدرَجُ في برنامجٍ تنفيذي كتصحيحٍ مؤقَّت لعَثْرة bug.", https://scs.org.sy/scs/qamous/search?q=scs/qamous/showterm/2855, 4, 12
"patch", "يُصلح بنقيلة","في البرمجة: يُصلِحُ خَلَلاً في وظيفيّةِ مَسَاقٍ routine موجودٍ أو برنامج، استجابةً لحاجةٍ غير متوقعة أو مجموعة من ظروف التشغيل. والإصلاحُ بنقيلةٍ هو وسيلةٌ عامةٌ لإضافةِ ميزةٍ أو وظيفةٍ إلى إصدارٍ موجودٍ من برنامجٍ يستمرّ استخدامُه حتى تسويق الإصدار التالي من البرمجيات.", https://scs.org.sy/scs/qamous/search?q=scs/qamous/showterm/2856, 4, 12
"pathname", "اسم المسار","في نظام ملفات تراتبيّ: مسْردةُ أدلّةٍ أو مصنَّفات folders تقود إلى ملفٍّ انطلاقاً من الدليل الحالي.", https://scs.org.sy/scs/qamous/search?q=scs/qamous/showterm/2857, 4, 12
"PC-DOS", "[نظام] PC-DOS","إصدارٌ من MS-DOS تَبيعُهُ IBM. إن MS-DOS وPC-DOS متطابقان افتراضياً، مع أن أسماءَ الملفات وبرامجَ النافعة utility لا تتطابق بين هذين الإصدارين أحياناً.", https://scs.org.sy/scs/qamous/search?q=scs/qamous/showterm/2858, 4, 12
