english,arabic,url,arabic_description
Cryptocurrency,عملة معمّاة,https://arabicglossary.dubaifuture.ae/ar/words/cryptocurrency,تسمية عامة لأي أصل رقمي أو «عملة رمزية» قابلة للتعدين أو الشراء أو النقل عبر شبكة بلوكتشين أو باستخدام شبكة حسابات موزعة. تُعد بيتكوين أشهر عملة معماة، ويتجاوز عددها الألف عملة، ومنها عملات إيثريوم ولايتكوين ونيو.
Development Operations (DevOps),عمليات التطوير,https://arabicglossary.dubaifuture.ae/ar/words/devops-development-operations,مصطلح يشير إلى تطوير برامج مؤسسية توضح العلاقة بين عمليات التطوير وتقنية المعلومات. وتهدف إلى تعزيز هذه العلاقة.
Server Side,عمليات المخدم,https://arabicglossary.dubaifuture.ae/ar/words/server-side,مصطلح يشير إلى العمليات التي يجريها المخدم ضمن حاسوب والمخدم في وقت واحد ضمن الشبكة الحاسوبية.
Technological design process,عملية التصميم التقني,https://arabicglossary.dubaifuture.ae/ar/words/technological-design-process,عملية تتضمن الخطوات التالية: تحديد المشكلة والبحث فيها وإنتاج حلول محتملة واختيار أفضلها وتطوير نموذج واختياره وتدقيقه وإعادة اختباره وفقًا للحاجة والإبلاغ بالحل النهائي.
Partially observable Markov decision process,عملية قرار ماركوف الملاحظة جزئيًا,https://arabicglossary.dubaifuture.ae/ar/words/partially-observable-markov-decision-process,تعميم لعملية قرار ماركوف المحاكية لعملية قرار الوكيل التي يُفترض فيها أن ديناميكيات النظام تحددها عملية قرار ماركوف، غير أن الوكيل لا يستطيع مراقبة الحالة الأساسية مباشرةً.
CRISP DM model,عملية قياسية عبر الصناعة لاستخراج البيانات.,https://arabicglossary.dubaifuture.ae/ar/words/crisp-dm-model,عملية تجري عبر الصناعة لاستخراج البيانات، وتقدم نهج منظم لتخطيط مشروع استخراج البيانات.
Reionization,عودة التأين,https://arabicglossary.dubaifuture.ae/ar/words/reionization,العملية التي تسببت في إعادة تأين المادة في الكون بعد انقضاء «العصور المظلمة». وتعد عودة التأين المرحلة الرئيسة الثانية التي حدث فيها تغير طوري للغاز في الكون.
Electrospinning,غزل كهربائي,https://arabicglossary.dubaifuture.ae/ar/words/electrospinning,عملية تحدث بسبب الجهد الكهربائي وتحكمها الظواهر الكهروهيدروديناميكية وتتكون خلالها ألياف وجسيمات من محلول بوليمر.
Abiotic,غير حيوي,https://arabicglossary.dubaifuture.ae/ar/words/abiotic,جسم مادي غير حيوي أي غير مشتق من الكائنات الحية.
Hypersonic,فائق صوتي - فرط صوتي - فرصوتي,https://arabicglossary.dubaifuture.ae/ar/words/hypersonic,متعلق بالسرعات الأعلى من سرعة الصوت بأكثر من 5 أضعاف. أو متعلق بالترددات الصوتية الأعلى من مليار هرتز تقريبًا.
Supersonic,فوق صوتي,https://arabicglossary.dubaifuture.ae/ar/words/supersonic,سرعة أكبر من سرعة الصوت.
Biodegradable,قابل للتحلل الحيوي,https://arabicglossary.dubaifuture.ae/ar/words/biodegradable,قابل للتحلل باستخدام البكتيريا أو الكائنات الدقيقة الأخرى ما يحد من التلوث.
Satisfiability,قابلية الإرضاء,https://arabicglossary.dubaifuture.ae/ar/words/satisfiability,وهو مفهوم أولي للدلالات في المنطق الرياضي، إذ تكون الصيغة مُرضية إذا كان من الممكن العثور على تفسير (نموذج) تكون فيه الصيغة صحيحة
Test Data Set,قاعدة بيانات الاختبار,https://arabicglossary.dubaifuture.ae/ar/words/test-data-set,قاعدة بيانات تستخدم لتقييم مدى تطابق النموذج النهائي مع قاعدة بيانات التدريب.
Graph database,قاعدة بيانات الرسم البياني,https://arabicglossary.dubaifuture.ae/ar/words/graph-database,قاعدة بيانات معتمِدة على الرسوم البيانية في الاستعمالات الدلالية مع العُقد والحواف والخصائص، لتمثيل البيانات وتخزينها.
Braincase,قحف الدماغ,https://arabicglossary.dubaifuture.ae/ar/words/braincase,الجزء الذي يحوي الدماغ في الجمجمة.
Black hat,قراصنة القبعة السوداء,https://arabicglossary.dubaifuture.ae/ar/words/black-hat,مجموعات قراصنة يمارسون نشاطات غير قانونية وغالبًا ما تدور حولهم القصص والأفلام. يخترق قراصنة القبعة السوداء شبكات وأنظمة آمنة من أجل تدمير أو تعديل أو سرقة بعض البيانات الحساسة أو تحويل الشبكات إلى شبكات غير قابلة للاستخدام
BiohackBiohack,قرصنة حيوية,https://arabicglossary.dubaifuture.ae/ar/words/biohackbiohack,تعزيز وظائف الجسم باستخدام أجهزة إلكترونية أو مواد كيميائية حيوية. وقد يشير المصطلح أيضًا إلى تعديل الحالة الحيوية للجسم باستخدام مزيج التقنيات الطبية والغذائية والإلكترونية.
Nanorods,قضبان نانوية,https://arabicglossary.dubaifuture.ae/ar/words/nanorods,قضيب من مادة بسمك أو قطر لا يتجاوز عدة نانومترات.
Stentrode,قطب كهربائي إستنتيّ,https://arabicglossary.dubaifuture.ae/ar/words/stentrode,عبارة عن مجموعة من الأقطاب الصغيرة المثبتة على دعامة تُزرع بشكل دائم في وعاء دموي في الدماغ دون الحاجة إلى إجراء جراحة في الدماغ.
Microelectrode,قطب كهربائي صغير,https://arabicglossary.dubaifuture.ae/ar/words/microelectrode,قطب كهربائي دقيق، خاصة ما يدخل في خلية أو نسيج بيولوجي حي عند دراسة خصائصه الكهربائية.
EmDrive,قوة الدفع الكهرومغناطيسي,https://arabicglossary.dubaifuture.ae/ar/words/emdrive,محرك صاروخي يعمل بالموجات الكهرومغناطيسية ويمثل أحد الابتكارات التي قد تغنينا عن الوقود خلال استكشاف الفضاء
Centrifugal force,قوة الطرد المركزي,https://arabicglossary.dubaifuture.ae/ar/words/centrifugal-force,القوة التي تؤثر على الجسم الذي يتحرك في مسار دائري وتدفعه نحو الخارج بعيدًا عن المركز.
Fully Autonomous Driving,قيادة ذاتية تامة,https://arabicglossary.dubaifuture.ae/ar/words/fully-autonomous-driving,مركبة تشعر بالبيئة المحيطة بها وتعمل بصورة مؤتمتة تمامًا دون تدخل بشري.
The Quantified Self,قياس كمي للذات,https://arabicglossary.dubaifuture.ae/ar/words/the-quantified-self,عملية استخدام البيانات الشخصية لتحسين جودة حياة الشخص. ويشير ذلك عادةً إلى الرعاية الصحية.
Robot apocalypse,قيامة الروبوتات,https://arabicglossary.dubaifuture.ae/ar/words/robot-apocalypse,مصطلح يصف سيناريو يكون فيه الذكاء الاصطناعي أو الروبوتات مكتفية ذاتيًا وقادرة على التحكم بشكل فعال في الأرض.
Extra-terrestrials,كائنات فضائية,https://arabicglossary.dubaifuture.ae/ar/words/extra-terrestrials,كائن من عالم آخر شيء ينشأ أو يوجد خارج الأرض وغلافها الجوي
Body Cameras,كاميرات الجسم,https://arabicglossary.dubaifuture.ae/ar/words/body-cameras,نظام تصوير وتسجيل مقاطع فيديو ومقاطع صوتية قابل للارتداء. وتمتاز هذه الأجهزة بتصميمات واستخدامات عديدة، مثل إدماجها في زي رجال الشرطة بالإضافة إلى استخدامات تجارية وطبية.
Space relay box,كبسولة الترحيل الفضائي,https://arabicglossary.dubaifuture.ae/ar/words/space-relay-box,قمر اصطناعي يستخدم لنقل إشارات الراديو والتلفزيون والهاتف حول الأرض ويدور عادة في مدار ثابت بالنسبة للأرض.
CRISPR-Cas9,كريسبر-كاس9,https://arabicglossary.dubaifuture.ae/ar/words/crispr-cas9,أداة تعديل وراثي تتعرف على سلاسل معينة في الحمض النووي وتقطعها من أجل تعديل صفات الكائنات أو معالجة العيوب الجينية.
Quark,كوارك,https://arabicglossary.dubaifuture.ae/ar/words/quark,أي جسيم من الجسيمات دون الذرية التي تحمل شحنة كهربائية جزئية، والتي تعد لبنات بناء الهادرونات. لم تُرصَد الكواركات مباشرة، ولكن التنبؤات النظرية القائمة على وجودها أُثبتت تجريبيًا.
Ceres,كوكب سيريس القزم,https://arabicglossary.dubaifuture.ae/ar/words/ceres,كوكب قزم يوجد ضمن حزام الكويكبات، ويبعد عن الشمس نحو 2.7 وحدة فلكية، ويبلغ قطره 950 كيلومترًا.
Frame language,لغة إطارية,https://arabicglossary.dubaifuture.ae/ar/words/frame-language,تقنية تستخدم لعرض البيانات في الذكاء الاصطناعي.
Query language,لغة استفسار,https://arabicglossary.dubaifuture.ae/ar/words/query-language,لغة لتحديد إجراءات استرجاع المعلومات من قاعدة بيانات (وتعديلها أحيانًا).
Probabilistic programming language,لغة برمجة احتمالية,https://arabicglossary.dubaifuture.ae/ar/words/probabilistic-programming-language,نموذج برمجة تُحدَّد فيه النماذج الاحتمالية، وتُجرى عمليات الاستدلال لهذه النماذج تلقائيًا.
Hypertext Markup Language (HTML),لغة ترميز النص الفائق (إتش تي إم إل),https://arabicglossary.dubaifuture.ae/ar/words/html-hypertext-markup-language,نظام موحَّد لترميز الملفات النصية لتحديد البُنط واللون والرسوميات والروابط التشعُّبية في صفحات شبكة الإنترنت.
Formal language,لغة شكلية,https://arabicglossary.dubaifuture.ae/ar/words/formal-language,تتكون اللغة المشكلة في الرياضيات وعلم الحاسوب واللغويات من كلمات مكونة من حروف هجائية مختارة بعناية وفقًا لمجموعة من القواعد.
Action language,لغة فعلية,https://arabicglossary.dubaifuture.ae/ar/words/action-language,لغة لوصف الأنظمة المتحولة، ويشيع استخدامها في إنشاء نماذج لتأثيرات الإجراءات على العالم. وتُستخدم اللغات الفعلية كثيرًا في مجالات الذكاء الاصطناعي والروبوتات، لأنها تصف كيف تؤثر الإجراءات على تغير حالات الأنظمة بمرور الوقت، ويمكن استخدامها للتخطيط المؤتمت.
Constructed language,لغة مصطنعة,https://arabicglossary.dubaifuture.ae/ar/words/constructed-language,مصطلح يشير إلى لغة اصطناعية لم تتطور بصورةٍ طبيعية.
Information Processing language,لغة معالجة المعلومات,https://arabicglossary.dubaifuture.ae/ar/words/information-processing-language,لغة برمجة يتضمّن ميزات تساعد في البرامج التي تؤدي إجراءات بسيطة لحل المشكلات مثل القوائم وتخصيص الذاكرة الديناميكية وأنواع البيانات والتكرار والدوال كوسائط والتوليد وتعدد المهام التعاوني.
Hover Board,لوح طائر,https://arabicglossary.dubaifuture.ae/ar/words/hover-board,مَركبة شخصية ذات محرك، يتألف من لوح للقدم، مثبَّت على عجلتين، ويَتحكم فيها الراكب بطريقة توزيع وزنه.
Solar panel,لوحة شمسية,https://arabicglossary.dubaifuture.ae/ar/words/solar-panel,لوحة مصممة لامتصاص أشعة الشمس لاستخدامها كمصدر للطاقة لتوليد الكهرباء أو التدفئة.
Genetic operator,مؤثر جيني,https://arabicglossary.dubaifuture.ae/ar/words/genetic-operator,عامل يُستعمل في الخوازرميات الوراثية لتوجيهها إلى حل مشكلة معيَّنة.
Hazard ratio,مؤشر المخاطر,https://arabicglossary.dubaifuture.ae/ar/words/hazard-ratio,نسبة معدلات الخطورة مقارنة بالظروف، ويحددها مستويان من المتغير التوضيحي.
Transhumanism,ما بعد الإنسانية - حركة تطوير البشرية,https://arabicglossary.dubaifuture.ae/ar/words/transhumanism,حركة فلسفية تدعو إلى تغيير حالة الإنسان عبر تطوير تقنيات متطورة تتيح تعديل الذكاء البشري والأعضاء البشرية أو تعزيزها، وإتاحتها على نطاق واسع.
Metamaterial,مادة خارقة,https://arabicglossary.dubaifuture.ae/ar/words/metamaterial,أي مادة مصممة هندسيًا لتكون لها خاصية غير موجودة في المواد الطبيعية.
The Epidemic Prediction Initiative (EPI),مبادرة التنبؤ بالأوبئة,https://arabicglossary.dubaifuture.ae/ar/words/the-epidemic-prediction-initiative,تهدف إلى تحسين علم التنبؤ بالأوبئة واستخدامه من خلال تسهيل تدشين مشاريع التنبؤ ذات أهداف الصحة العامة المحددة.
Net-Zero Buildings (zero-energy building),مباني صفرية الطاقة,https://arabicglossary.dubaifuture.ae/ar/words/net-zero-buildings,مبنى باستهلاك صافٍ صفري للطاقة، أي أن إجمالي الطاقة المستخدمة في المبنى تعادل كمية الطاقة المتجددة في الموقع لعام معين، أو خارج الموقع في تعريفات أخرى لمصادر الطاقة المتجددة، باستخدام تقنيات مثل المضخات الحرارية والنوافذ عالية الكفاءة والعزل والألواح الشمسية.
Renewable,متجدد,https://arabicglossary.dubaifuture.ae/ar/words/renewable,مورد طبيعي أو مصدر لطاقة لا ينضب عن طريق الاستخدام مثل طاقة المياه أو طاقة الرياح أو الطاقة الشمسية.
Ensemble Averaging,متوسط المجموعة,https://arabicglossary.dubaifuture.ae/ar/words/ensemble-averaging,متوسط الكمية وهو وظيفة الحالة الدقيقة للنظام، وفقًا لتوزيع النظام على الحالات الدقيقة في هذه المجموعة.
Ultracompact dwarf galaxy,مجرة قزمة فائقة الصغر,https://arabicglossary.dubaifuture.ae/ar/words/ultracompact-dwarf-galaxy,مجرات تتسم بوجود نجوم معمرة، وهي ذات حجم وسطوع أكبر من العناقيد المغلقة في مجرة درب التبانة، لكنها في الوقت ذاته أكثر ارتصاصًا بكثير من المجرات القزمة العادية ذات السطوع المشابه.
Singular Value Decomposition (SVD),مجزئ القيمة المفردة,https://arabicglossary.dubaifuture.ae/ar/words/singular-value-decomposition,هو تحليل لمصفوفة حقيقية أو معقدة يعمم التكوين الإلكتروني لمصفوفة عادية مربعة على أي مصفوفة عبر تمديد التجزيئ القطبي
Visible Infrared Imaging Radiometer Suite (VIIRS),مجموعة التصوير الشعاعي بالأشعة تحت الحمراء المرئية (في آي آي آر إس),https://arabicglossary.dubaifuture.ae/ar/words/visible-infrared-imaging-radiometer-suite,أداة استشعار من تصميم وتصنيع شركة رايثيون على متن قمر شراكة سومي الوطنية للمدار القطبي وقمر الرصد الجوي NOAA-20.
Data set,مجموعة بيانات,https://arabicglossary.dubaifuture.ae/ar/words/data-set,تجميع مجموعات المعلومات المرتبطة ببعضها والتي تتكون من عناصر منفصلة لكن الحاسوب يستطيع التعامل معها كوحدة.
Validation Data Set,مجموعة بيانات التحقق من صحة العمل,https://arabicglossary.dubaifuture.ae/ar/words/validation-data-set,عينة من البيانات التي احتُفظ بها من تدريب النموذج المُستخدم في تخمين مهارة النموذج أثناء ضبط بنية متغيراته الافتراضية.
Training Data Set,مجموعة بيانات التدريب,https://arabicglossary.dubaifuture.ae/ar/words/training-data-set,مجموعة أولية من البيانات المستخدمة لمساعدة برنامج على فهم كيفية تطبيق تقنيات مثل الشبكات العصبية للتعلم وتحقيق نتائج متقدمة.
Exercise mimetic,محاكِيات التمرُّن,https://arabicglossary.dubaifuture.ae/ar/words/exercise-mimetic,مركب دوائي ينتج فوائد التمرينات الرياضية
Rich Text Editor (RTE),محرر النص الغني,https://arabicglossary.dubaifuture.ae/ar/words/rich-text-editor,إطار أساسي لإدراج المحتوى النصي في برنامج أدوبي إكسبرنيس مانجر، وبشكل لأساس لمكونات مختلفة، بما في ذلك النصوص والصورة النصية والجدول.
Inference engine,محرك استدلال,https://arabicglossary.dubaifuture.ae/ar/words/inference-engine,بروتوكول برنامج للتنقل عبر القواعد والبيانات في نظام معرفي لحل المشكلة. وتتمثل المهمة الرئيسة لمحرك الاستدلال في تحديد القاعدة الأكثر ملاءمة ثم تطبيقها في كل خطوة خلال تشغيل النظام، ويسمى ذلك الاستدلال المستند إلى القواعد
Search engine,محرك بحث,https://arabicglossary.dubaifuture.ae/ar/words/search-engine,برنامج يبحث عن عناصر في قاعدة البيانات التي تتوافق مع الكلمات الأساسية أو الأحرف التي حددها المستخدم أو المستخدمة بشكل خاص للعثور على مواقع معينة على شبكة الإنترنت العالمية.
Semantic reasoner,محرك برمجي استدلالي,https://arabicglossary.dubaifuture.ae/ar/words/semantic-reasoner,هو برنامج قادر على استنتاج النتائج المنطقية من مجموعة من الحقائق المؤكدة أو البديهيات.
Neural Compute Engine,محرك حوسبة عصبية,https://arabicglossary.dubaifuture.ae/ar/words/neural-compute-engine,مجموعة عتادية على شريحة مصممة خصيصًا لتشغيل الشبكات العصبونية العميقة بسرعة عالية وطاقة منخفضة دون التأثير على الدقة، ويتيح ذلك للأجهزة رؤية بيئاتها وفهمها والاستجابة لها في الوقت الفعلي.
Pulse detonation combustion engines,محركات احتراق التفجير النبضي,https://arabicglossary.dubaifuture.ae/ar/words/pulse-detonation-combustion-engines,نوع من أنظمة الدفع. يستخدم موجات تفجيرية لحرق خليط الوقود والمؤكسد.
Lab-on-a-chip,مختبر على رقاقة,https://arabicglossary.dubaifuture.ae/ar/words/lab-on-a-chip,"مختبر على رقاقة هو جهاز يدمج وظيفة مخبرية واحدة أو عدة وظائف مخبرية على دائرة متكاملة واحدة (تسمى عادة ""رقاقة"") يتراوح حجمها من ملليمترات فقط إلى بضعة سنتيمترات مربعة، ويستخدم لتطبيق الأتمتة والفحص عالي الإنتاجية."
Server,مخدم,https://arabicglossary.dubaifuture.ae/ar/words/server,جهاز حاسوب أو برنامج حاسوبي يتحكم بالوصول إلى مورد أو خدمة مركزية في الشبكة الحاسوبية.
Hazardous Waste,مخلفات خطيرة,https://arabicglossary.dubaifuture.ae/ar/words/hazardous-waste,أي ناتج ثانوي صناعي أو مخلَّف تجاري يُحتمَل أن يضر البيئة أو الناس أو الكائنات الحية الأخرى، من الكائنات الحية، لأنه قابل للاشتعال أو الانفجار أو سام أو تفاعُليّ.
Orbital precession,مداورة مدارية,https://arabicglossary.dubaifuture.ae/ar/words/orbital-precession,تغير اتجاه محور دوران الأرض، أي تغير اتجاه الأرض بالنسبة للحضيض والأوج.
Deep space climate observatory (DSCOVR),مرصد مناخ الفضاء العميق,https://arabicglossary.dubaifuture.ae/ar/words/deep-space-climate-observatory-dscovr,مركبة فضائية مدارها بين الأرض والشمس. وتراقب الرياح الشمسية والجسيمات المنبعثة من الشمس والتي قد تؤثر على الشبكات الكهربائية وأنظمة الاتصالات والأقمار الاصطناعية القريبة من الأرض وتطلق تحذيرات في حالة انبعاثها
Autonomous vehicle,مركبات مستقلة,https://arabicglossary.dubaifuture.ae/ar/words/autonomous-vehicle,تُعرف أيضًا باسم السيارة ذاتية القيادة أو المركبة دون سائق أو السيارة الآلية، وهي مركبة قادرة على استشعار بيئتها والتحرك بأمان بقليل من التحكم البشري أو دونه
Spacecraft,مركبة فضائية,https://arabicglossary.dubaifuture.ae/ar/words/spacecraft,مركبة تستخدم للرحلات إلى الفضاء
Orbiter,مركبة مدارية,https://arabicglossary.dubaifuture.ae/ar/words/orbiter,مسبار فضائي مصمم للذهاب إلى مدارات الكواكب، وهو غير مصمم للهبوط عليها.
Data centrecentre,مركز البيانات,https://arabicglossary.dubaifuture.ae/ar/words/data-centrecentre,مجموعة كبيرة من خوادم الحواسيب المرتبطة معًا تستخدمها المنظمات لتخزين البيانات عن بعد ومعالجتها وتوزيعها.
Quadcopter,مروحية رباعية,https://arabicglossary.dubaifuture.ae/ar/words/quadcopter,طائرة مروحية دون طيار مزودة بأربع شفرات دوارة.
Intelligent Personal Assistant,مساعد شخصي ذكي,https://arabicglossary.dubaifuture.ae/ar/words/intelligent-personal-assistant,برنامج صمم لمساعدة الأشخاص في المهام الأساسية، ويوفر المعلومات غالبًا باستخدام اللغة الطبيعية. تستخدم معظم برامج المساعد الشخصي الذكي الموارد الموجودة على شبكة الإنترنت للإجابة على أسئلة المستخدم عن الطقس والنتائج الرياضية واتجاهات قيادة المركبات والإجابة على استفسارات مماثلة.
Supernova,مستعر أعظم,https://arabicglossary.dubaifuture.ae/ar/words/supernova,انفجار نجمي قوي ومضيء. يحدث هذا الحدث الفلكي العابر خلال المراحل التطورية الأخيرة لنجم هائل أو عندما يمر قزم أبيض (نوع من أنواع النجوم في مجرتنا) باندماج نووي سريع.
Lunar Reconnaissance Orbiter (LRO),مستكشف القمر المداري,https://arabicglossary.dubaifuture.ae/ar/words/lunar-reconnaissance-orbiter-lro,مركبة فضائية روبوتية لوكالة ناسا، تدور حول القمر في مدار قطبي منحرف لرسم الخرائط. وصفت البيانات التي جمعتها المركبة بأنها أساسية للتخطيط لبعثات ناسا المأهولة والروبوتية على القمر.
Data warehouse,مستودع البيانات,https://arabicglossary.dubaifuture.ae/ar/words/data-warehouse,مخزن إلكتروني يستطيع تخزين كمية كبيرة من المعلومات للشركة أو المنظمة
