english,arabic,url,arabic_description
Electronic Communication,اتصال إلكتروني,https://arabicglossary.dubaifuture.ae/ar/words/electronic-communication,اتصالات تجرى عبر أنظمة سلكية ولاسلكية مثل البريد الإلكتروني والرسائل النصية والفاكس والشبكات الاجتماعية.
Alpha testing,اختبار ألفا,https://arabicglossary.dubaifuture.ae/ar/words/alpha-testing,نوع من اختبار البرمجيات يجرى لكشف الأخطاء قبل إصدار البرمجيات للمستخدمين
Stop signal task,اختبار إشارة التوقف,https://arabicglossary.dubaifuture.ae/ar/words/stop-signal-task,هو اختبار لتثبيط الاستجابات القهرية. يتطلب من المشارك الاستجابة بأسرع ما يمكن لحافز محدد مسبقًا، وعدم إظهار أي استجابة عندما تُعرض إشارة التوقف.
Beta testing,اختبار بيتا,https://arabicglossary.dubaifuture.ae/ar/words/beta-testing,وهو تجربة البرمجيات أوليًا والتأكد من صحة عملها قبل دخولها مرحلة الإنتاج الصناعي الواسع والاستخدام.
Static test,اختبار ثبات,https://arabicglossary.dubaifuture.ae/ar/words/static-test,تقنية اختبار برمجية يتم من خلالها اختبار البرنامج دون تنفيذ الكود البرمجي.
Feature selection,اختيار المميزات,https://arabicglossary.dubaifuture.ae/ar/words/feature-selection,العملية التي يجري من خلالها اختيار مجموعة فرعية من الميزات أو المتغيرات المرتبطة ببعضها من مجموعة بيانات أكبر لوضع النماذج. وتسمى أيضًا تحديد المتغير أو تحديد السمة أو تحديد المجموعة الفرعية المتغيرة. وتركز العملية على اختيار الميزات التي تمثل مجموعة البيانات بدقة من خلال استبعاد البيانات الزائدة عن الحاجة وغير ذات الصلة. ويختلف ذلك عن استخلاص الميزات الذي يوجد ميزات جديدة كوظائف للميزة الأصلية
Knowledge extraction,استخراج المعرفة,https://arabicglossary.dubaifuture.ae/ar/words/knowledge-extraction,عملية اكتشاف الكيفية التي تستخدم بها مدخلات في شبكة عصبية اصطناعية لتشكيل مخرجات بما يتيح التثبت من صحة العلاقات الوظيفية في النموذج
"Extract, transform, and load (ETL)",استخراج وتحويل وتحميل,https://arabicglossary.dubaifuture.ae/ar/words/extract-transform-and-load,الإجراء العام لنسخ البيانات من مصدر واحد أو أكثر إلى الوجهة التي تمثل البيانات بشكل مختلف عن المصدر أو في سياق مختلف عن المصدر
Rendering,استخلاص (حوسبة),https://arabicglossary.dubaifuture.ae/ar/words/rendering,هي عملية إنشاء صورة واقعية أو غير واقعية من نموذج ثنائي الأبعاد أو ثلاثي الأبعاد باستخدام البرامج الحاسوبية..
Feature extraction,استخلاص المميزات,https://arabicglossary.dubaifuture.ae/ar/words/feature-extraction,عملية تختصر البيانات الأولية وتحولها إلى مجموعات أكثر قابلية للإدارة والمعالجة لتقليل موارد الحوسبة المطلوبة. ويتضمن استخلاص الميزات الأساليب التي تحدد المتغيرات في الميزات وتجمعها، ما يقلل كمية البيانات التي تحتاج للمعالجة. وتحافظ في الوقت ذاته على الوصف الدقيق للبيانات الأصلية.
Foresight,استشراف المستقبل,https://arabicglossary.dubaifuture.ae/ar/words/foresight,استشراف المستقبل هي طريقة منهجية للاستفادة من الفرص المستقبلية على المدى المتوسط إلى الطويل وتجنب مخاطرها، وذلك باتخاذ قرارات أفضل اليوم.
Terraform,استصلاح,https://arabicglossary.dubaifuture.ae/ar/words/terraform,مصطلح خيال علمي يتضمن تحويل أي كوكب إلى صورة مشابهة للأرض كي تدعم الحياة.
Semantic query,استفسار دلالي,https://arabicglossary.dubaifuture.ae/ar/words/semantic-query,يسمح بالاستفسارات والتحليلات ذات الطبيعة الترابطية والسياقية وتتيح استرجاع المعلومات المشتقة صراحةً وضمنيًا بناءً على المعلومات النحوية والدلالية والهيكلية الموجودة في البيانات.
Glowworm swarm optimization,استمثال أسراب سراج الليل,https://arabicglossary.dubaifuture.ae/ar/words/glowworm-swarm-optimization,خوارزمية استمثال حالية مستوحاة من الطبيعة، تحاكي سلوك سراج الليل. وهي مناسبة للبحث التزامُنيّ لعدة حلول وقِيَم دالة موضوعية متساوية أو غير متساوية. وتوجد عدة مراجعات تصف تطبيقاتها في مجالات مختلفة، منها العَنقَدة ومشكلات استمثال مختلفة.
Particle swarm Optimization,استمثال عناصر السرب,https://arabicglossary.dubaifuture.ae/ar/words/particle-swarm-optimization,طريقة حسابية تقدم الحل الأمثل لمشكلة من خلال تكرار محاولة تحسين أحد الحلول المرشحة وفق مقياس معين للجودة.
Cloud Seeding,استمطار,https://arabicglossary.dubaifuture.ae/ar/words/cloud-seeding,تقنية لتعديل الطقس لتغيير كمية هطول الأمطار أو نوعها من الغيوم من خلال نثر مواد معينة فيها لتعمل على تكثيف بخار الماء أو تصبح نواة لتشكل الثلج.
Data Ingestion,استيعاب البيانات,https://arabicglossary.dubaifuture.ae/ar/words/data-ingestion,نقل البيانات من مصادر مجمعة إلى وحدة تخزين يمكن الوصول إليها واستخدامها وتحليلها من خلال منظمة أخرى.
Decentralised Autonomous Organisation (DAO) proposals,اقتراحات المنظمة المستقلة اللامركزية,https://arabicglossary.dubaifuture.ae/ar/words/decentralised-autonomous-organisation-dao-proposals,الأفكار التي تطرح أمام أعضاء المنظمة للنظر فيها والتصويت عليها.
Gig economy,اقتصاد العمل المؤقت,https://arabicglossary.dubaifuture.ae/ar/words/gig-economy,النشاط الاقتصادي المعتمد على العمالة والعقود المرنة والمؤقتة، وقد يكون الدخل الناتج عن هذه الأعمال أساسياً أو تكميلياً.
Machines,الآلات,https://arabicglossary.dubaifuture.ae/ar/words/machines,الحواسيب أو الروبوتات المزودة بوحدات معالجة أو المتصلة بوحدات معالجة. يرجى الاطلاع على تعريف الذكاء الآلي المتقدم.
Autonomous machines,الآلات المستقلة,https://arabicglossary.dubaifuture.ae/ar/words/autonomous-machines,الآلات المستقلة آلات مبرمجة للعمل ذاتياً، تستطيع أداء مجموعة واسعة من المهام المعقدة دون الحاجة إلى أدوات تحكم أو أوامر خارجية.
Basic Research,الأبحاث الأساسية,https://arabicglossary.dubaifuture.ae/ar/words/basic-research,الأبحاث الأساسية هي أبحاث تهدف إلى فهم الجوانب الأساسية من الظواهر العلمية بغض النظر عن التطبيق أو الاستخدام أو مجال الاهتمام. والأبحاث الأساسية هي عكس الأبحاث التطبيقية التي تهدف إلى إجراء الأبحاث من أجل التوصل إلى حلول للمشاكل.
X events (Black Swans),الأحداث المفاجئة (البجعات السوداء),https://arabicglossary.dubaifuture.ae/ar/words/x-eventsblack-swans,الأحداث المفاجئة هي أحداث غير متوقعة تؤدي إلى زيادة الأعباء على النظام وتعقّد الحالة الراهنة، وتنتج غالباً عن عامل خارجي عشوائي، إما طبيعي وإما بشري المنشأ.
Wild cards,الأحداث غير المتوقعة,https://arabicglossary.dubaifuture.ae/ar/words/wild-cards,الأحداث غير المتوقعة هي الأحداث ذات الاحتمالية المنخفضة والتأثير العالي طويل المدى، وتسمّى أيضاً بعوامل التغيير الجذري.
Super-earth,الأرض الهائلة,https://arabicglossary.dubaifuture.ae/ar/words/super-earth,كوكب خارجي ذو كتلة أعظم من كتلة الأرض، لكنه أقل حجمًا من العملاقين الثلجيين أورانوس ونبتون.
Nanoelectrodes,الأقطاب الكهربائية النانوية,https://arabicglossary.dubaifuture.ae/ar/words/nanoelectrodes,أقطاب كهربائية صغيرة مصنوعة من معادن أو مواد شبه موصلة لها أبعاد نموذجية تتراوح بين 1 و100 نانومتر.
Knowledge-based systems,الأنظمة القائمة على المعرفة,https://arabicglossary.dubaifuture.ae/ar/words/knowledge-based-systems,نظام حاسوبي يولد المعرفة ويستخدمها من مختلف المصادر والبيانات والمعلومات. وتساعد هذه الأنظمة في حل المشكلات، وخاصة المعقدة منها، بالاستعانة بمفاهيم الذكاء الاصطناعي. تستخدم هذه الأنظمة غالبًا في العمليات الهادفة لحل المشكلات، بالإضافة إلى دعم التعلم البشري وصنع القرارات واتخاذ الإجراءات.
Complicated systems,الأنظمة المعقدة,https://arabicglossary.dubaifuture.ae/ar/words/complicated-systems,تعرّف الأنظمة المعقدة بأنها نظم واضحة الحدود على الرغم من أنها معقدة التركيب. وهي لا تتمتع بالقدرة على التكيف مع التغييرات، فإن تعطّل عنصر من أي منها يتعطل النظام كاملاً. فهي أنظمة تعتمد على القواعد والتعليمات الواضحة للوصول إلى نتيجة ولديها درجة يقين عالية. فمثلاً، تعدّ الكاميرا الحديثة والقمر الاصطناعي والصاروخ الفضائي جميعاً أنظمة معقدة.
Complex systems,الأنظمة المعقدة المترابطة,https://arabicglossary.dubaifuture.ae/ar/words/complex-systems,الأنظمة المعقدة المترابطة تحتوي على عدد كبير من الأجزاء المتحركة والمتغيرة والقابلة للتكيف، فهي ديناميكية بطبيعتها وتتطلب تفكيراً منظومياً. لا يمكن فهمها بالكامل من خلال تجزئة مكوناتها لأنها ليست خطيّة. فمثلاً يُعد كلا المجتمع البشري ومستعمرة النحل نظاماً معقداً مترابطاً.
Weak Signals,الإشارات الضعيفة,https://arabicglossary.dubaifuture.ae/ar/words/weak-signals,الإشارات الضعيفة تحذيرات وأحداث وتطورات (خارجية أو داخلية) ما زالت في مرحلتها المبدئية فلا تتيح لنا تحديد التقديرات الدقيقة لتأثيرها أو القيام بردود الفعل اللازمة لها.
Bioluminescence,الإضاءة الحيوية,https://arabicglossary.dubaifuture.ae/ar/words/bioluminescence,إنتاج كائن حي للضوء الذي ينبعث منه بسبب التفاعلات الكيميائية التي تحدث داخله أو تصدر عنه.
Wireframe,الإطار الشبكي,https://arabicglossary.dubaifuture.ae/ar/words/wireframe,دليل مرئي يمثل الهيكل العظمي لموقع الويب. يتم إنشاء الإطار الشبكي بغرض ترتيب العناصر في الموقع لتحقيق هدف معين بأفضل طريقة.
Just-In-Time,الإنتاج في الوقت المحدد,https://arabicglossary.dubaifuture.ae/ar/words/just-in-time,مفهوم مستخدم في مجالات التصنيع والإنتاج وإدارة المخزون، ويعني استلام المدخلات عند الحاجة إليها عوضاً عن استلامها مقدماً، لخفض التكلفة وتوفير الوقت.
Computational Creativity,الابتكار الحوسبي,https://arabicglossary.dubaifuture.ae/ar/words/computational-creativity,القدرة على ابتكار حلول جديدة باستخدام الوسائل الحوسبية.
Trends,الاتجاهات,https://arabicglossary.dubaifuture.ae/ar/words/trends,تختلف الاتجاهات عن الاتجاهات الكُبرى بأنها محصورة في قطاع معين أو منطقة واحدة. قد يتّسم الاتّجاه بالقوّة أو بالضعف، وقد يكون متزايداً أو متناقصاً أو مستقراً. ولا نضمن استمرارية الاتّجاه الملاحظ من الماضي إلى المستقبل. وقد تتحوّل الاتجاهات إلى اتّجاهات كبرى إن أصبحت تحدث على نطاق عالمي.
Megatrends,الاتجاهات الكبرى,https://arabicglossary.dubaifuture.ae/ar/words/megatrends,تعرّف الاتجاهات الكبرى بأنها تحولات عالمية طويلة المدى تؤثر على جميع قطاعات المجتمع وعلى جميع المستويات.
Brain to brain communication,الاتصال بين دماغين,https://arabicglossary.dubaifuture.ae/ar/words/brain-to-brain-communication,اتصال مباشر بين دماغي حيوانين.
Connectionism,الارتباطية,https://arabicglossary.dubaifuture.ae/ar/words/connectionism,مدرسة في العلم المعرفي تتضمن العمليات العقلية البشرية ويمكن تفسيرها باستخدام النمذجة الحاسوبية للشبكات العصبية ويعتقد أنها تحاكي أفعال الخلايا العصبية المرتبطة في الدماغ
Sustainability,الاستدامة,https://arabicglossary.dubaifuture.ae/ar/words/sustainability,قدرة النظم الحيوية والحضارة البشرية على التعايش معًا.
Spatial-temporal reasoning,الاستدلال المكاني-الزماني,https://arabicglossary.dubaifuture.ae/ar/words/spatial-temporal-reasoning,هو مجال للذكاء الاصطناعي المستمد من مجالات علوم الحاسوب والعلوم المعرفية وعلم النفس المعرفي.
Abductive reasoning,الاستدلال المنطقي,https://arabicglossary.dubaifuture.ae/ar/words/abductive-reasoning,استخدام المعرفة الحالية للوصول إلى استنتاجات أو توقعات أو وضع تفسيرات. ويبدأ بمجموعة غير كاملة من الملاحظات للوصول إلى أقرب التفسيرات.
Stochastic optimization,الاستمثال الاحتمالي,https://arabicglossary.dubaifuture.ae/ar/words/stochastic-optimization,طريقة تحسين تولد وتستخدم المتغيرات العشوائية.
Automated reasoning,الاستنتاج المؤتمت,https://arabicglossary.dubaifuture.ae/ar/words/automated-reasoning,عملية عامة تمنح خوارزميات تعلم الآلة إطاراً منظماً لوضع نهج لحل المشكلات.
Blue Economy,الاقتصاد الأزرق,https://arabicglossary.dubaifuture.ae/ar/words/blue-economy,يشير الاقتصاد الأزرق إلى القطاع الاقتصادي القائم على الاستخدام المستدام لموارد المحيطات من أجل كسب العيش وتوليد الإيرادات.
Circular Economy,الاقتصاد الدائري,https://arabicglossary.dubaifuture.ae/ar/words/circular-economy,في الاقتصاد الدائري، يتم استخدام السلع والخدمات لأطول فترة ممكنة ويتم تجنب جميع أشكال الهدر أو إعادتها مرة أخرى إلى سلسلة القيمة الخاصة بإنتاج السلع أو الخدمات.
Motion capture,الالتقاط البصري للحركة,https://arabicglossary.dubaifuture.ae/ar/words/motion-capture,عملية تسجيل حركة الأشياء أو الأشخاص. تُستخدَم في التطبيقات العسكرية والترفيهية والرياضية والطبية وللتحقق من صحة رؤية الحواسيب والروبوتات.
Backpropagation,الانتشار الخلفي,https://arabicglossary.dubaifuture.ae/ar/words/backpropagation,أسلوب تعلم خاضع للإشراف للشبكات العصبية يحسب تدرج النسب لترجيح المتغيرات المختلفة. وتمثل التسمية اختصارًا لمصطلح الانتشار العكسي للأخطاء، وتعني حساب الخطأ عند المخرجات وتوزيعه عكسيًا عبر طبقات الشبكة
Teleportation,الانتقال الآني,https://arabicglossary.dubaifuture.ae/ar/words/teleportation,الانتقال من مكانٍ إلى آخر بصورة لحظية، ويرتبط ذلك بالخيال العلمي.
Brute-force search,البحث الشامل,https://arabicglossary.dubaifuture.ae/ar/words/brute-force-search,تقنية عامة لحل المشكلات تتضمن تحديد جميع الحلول المحتملة وتقييم درجة وفاء كل حل بمتطلبات المشكلة.
Search for Extraterrestrial Intelligence,البحث عن أشكال الحياة الذكية خارج الأرض,https://arabicglossary.dubaifuture.ae/ar/words/search-for-extraterrestrial-intelligence,هو مصطلح عام لعمليات البحث العلمي عن حياة ذكية خارج كوكب الأرض، وتشمل على سبيل المثال مراقبة الإشعاع الكهرومغناطيسي بحثًا عن علامات الإرسال من الحضارات على الكواكب الأخرى.
Declarative programming,البرمجة التصريحية,https://arabicglossary.dubaifuture.ae/ar/words/declarative-programming,نموذج البرمجة الذي يحدد فيه المبرمج ما يجب أن ينجزه البرنامج دون تحديد كيفية تنفيذه.
Abductive logic programming,البرمجة المنطقية الاستدلالية,https://arabicglossary.dubaifuture.ae/ar/words/abductive-logic-programming,إطار لتمثيل المعرفة عالية المستوى يستخدم لحل المشكلات اعتمادًا على المنطق الاستدلالي. وهو يعزز البرمجة المنطقية العادية من خلال تعريف بعض المسندات بصورةٍ غير كاملة، فتصبح مسندات قابلة للاستدلال. وتحل المشكلة من خلال اشتقاق فرضيات على هذه المسندات القابلة للاستدلال. وقد تكون هذه المشكلات إما ملاحظات تحتاج إلى شرح (مثلما نجد في الاستدلال الكلاسيكي) أو أهداف يجب تحقيقها (مثل الحال في البرمجة المنطقية العادية)
Carbapenem resistant Enterobacteriaceae (CRE),البكتيريا المعوية المقاومة للكاربابينيم,https://arabicglossary.dubaifuture.ae/ar/words/carbapenem-resistant-enterobacteriaceae-cre,نوع من البكتيريا
Central Bank,البنك المركزي,https://arabicglossary.dubaifuture.ae/ar/words/central-bank,البنك المركزي هو مؤسسة عامة تدير العملة والاستقرار المالي من خلال تحديد أسعار الفائدة في أغلب الأحيان. ويُُشار إلى ذلك أيضاًً باسم السياسة النقدية للدولة.
Big data,البيانات الضخمة,https://arabicglossary.dubaifuture.ae/ar/words/big-data,مصطلح يشير إلى مجموعة بيانات يصعب تخزينها أو معالجتها بالأدوات أو التطبيقات التقليدية بسبب ضخامتها وتعقيدها
Carbon-dating,التأريخ باستخدام الكربون,https://arabicglossary.dubaifuture.ae/ar/words/carbon-dating,حساب عمر الأجسام القديمة من خلال قياس كمية صور الكربون المختلفة الموجودة في الجسم.
Urbanisation,التحضر,https://arabicglossary.dubaifuture.ae/ar/words/urbanisation,انتقال الناس إلى المدن وزيادة حجم التطور واتساعه، أو نمو المراكز الحضرية وتحولها إلى مراكز عالمية محورية.
Transcranial magnetic stimulation,التحفيز المغناطيسي عبر القحف,https://arabicglossary.dubaifuture.ae/ar/words/transcranial-magnetic-stimulation,طريقة تحفيز دماغي غير باضعة يُستخدم فيها مجال مغناطيسي متغير لإنتاج تيار كهربائي في منطقة معينة من الدماغ بالحث الكهرومغناطيسي.
Intelligent control,التحكم الذكي,https://arabicglossary.dubaifuture.ae/ar/words/intelligent-control,نوع من تقنيات التحكم تستخدم أساليب حوسبة الذكاء الاصطناعي مثل الشبكات العصبية الاصطناعية واحتمالات بيشان والمنطق الضبابي وتعلم الآلة والتعلم المعزِّز والحوسبة التطورية وخوارزميات الجينات.
Stochastic semantic analysis,التحليل الدلالي العشوائي,https://arabicglossary.dubaifuture.ae/ar/words/stochastic-semantic-analysis,هو نهج يستخدم في علوم الحاسوب كدلالة لفهم اللغة الطبيعية. تستخدم النماذج العشوائية عمومًا تعريف مقاطع الكلمات كوحدات دلالية أساسية للنماذج الدلالية، وفي بعض الحالات تتضمن نهجًا ثنائي الطبقات.
Morphological analysis,التحليل الشكلي,https://arabicglossary.dubaifuture.ae/ar/words/morphological-analysis,التحليل الشكلي تقنية لدراسة المشكلات المعقدة بطريقة ذات هيكلية محددة.
Cluster analysis,التحليل العنقودي,https://arabicglossary.dubaifuture.ae/ar/words/cluster-analysis,تقنية تصنيف إحصائي لمعرفة انتماء الأفراد لمجموعات مختلفة من خلال تنفيذ مقارنات كمية ذات خواص متعددة.
Predictive Analytics,التحليلات التنبؤية,https://arabicglossary.dubaifuture.ae/ar/words/predictive-analytics,استخدام الإحصاءات والمحاكاة لتوقع الأداء المستقبلي بناءً على البيانات الحالية والتاريخية.
Biochemical conversion,التحول الكيميائي الحيوي.,https://arabicglossary.dubaifuture.ae/ar/words/biochemical-conversion,يتضمن استخدام إنزيمات البكتيريا والكائنات الدقيقة الأخرى لتحليل الكتلة الحيوية من خلال عملية الهضم اللاهوائي أو التخمر أو التسميد.
Automated planning and scheduling,التخطيط المؤتمت,https://arabicglossary.dubaifuture.ae/ar/words/automated-planning-and-scheduling,التخطيط المؤتمت هو فرع من الذكاء الاصطناعي يركز على تحقيق الاستراتيجيات أو تسلسل الإجراءات، وينفذ عبر برمجيات عملاء أذكياء وروبوتات مستقلة ومركبات ذاتية القيادة. وخلافًا لمشكلات التحكم والتصنيف الكلاسيكية، فإن الحلول معقدة ويجب اكتشافها وتحسينها في فضاء متعدد الأبعاد.
Cultural Heritage,التراث الثقافي,https://arabicglossary.dubaifuture.ae/ar/words/cultural-heritage,يشمل التراث الثقافي المواقع والأشياء والممارسات التي يعتبرها المجتمع قديمة وتستحق الحفاظ عليها. ويمكن أن تكون رمزية أو تاريخية أو فنية أو جمالية أو علمية أو غيرها.
Backward chaining,التسلسل الخلفي,https://arabicglossary.dubaifuture.ae/ar/words/backward-chaining,طريقة استنتاج تعمل في خلف الهدف. وتستخدم في النظرية الآلية ومحركات الاستنتاج ومساعدات الإثبات وتطبيقات الذكاء الاصطناعي الأخرى.
Search Engine Marketing (SEM),التسويق عبر محركات البحث,https://arabicglossary.dubaifuture.ae/ar/words/search-engine-marketing,شكل من أشكال التسويق عبر شبكة الإنترنت يتضمن الترويج لمواقع الشبكة من خلال زيادة ظهورها في صفحات نتائج محرك البحث بشكل أساسي من خلال الإعلانات المدفوعة.
