English Term,Arabic Term,Arabic Description
A/B Testing,اختبار أ/ب,طريقة إحصائية لمقارنة أسلوبين أو أكثر؛ لتحديد أي منهما يعمل بطريقة أفضل، وفهم ما إذا كان الاختالف ذا دلالة إحصائية. .
Abduction,استخلاص,انظر استدلال استخلاصي. .
Abductive Logic Programming (ALP),برمجة منطقية استخلاصية,إطار يجمع بين البرمجة المنطقية والاستدلال الاستخلاصي؛ لتوليد تفسيرات أو فرضيات معقولة للبيانات أو الأحداث المرصودة. .
Abductive Reasoning,استدلال استخلاصي,عملية استنتاج نتائج محتملة بناًء على معلومات معروفة. وُيطلق عليها أيًضا استخلاص.    . .
Ablation Study,دراسة استئصالية,اختبار علمي ُيستخدم لتحليل أداء نموذج ما عن طريق إزالة بعض ُمكِّوناته أو تعطيلها بطريقة منهجية وتقييم تأثير ذلك في الأداء. .
Abstract Datatype,نوع بيانات مجرد,مجموعة من قيم البيانات والعمليات ذات الصلة التي تكون مستقلة عن أي تنفيذ. .
Accountability,مسؤولية,حالة من المسؤولية عن شيء ما بناًء على التنظيم أو الاتفاق أو التعيين. .
Accuracy,دقة,معدل التنبؤات الصحيحة التي يقدمها نموذج التصنيف. .
Action,فعل,آلية في التعُّلم التعزيزي، ينتقل بها الوكيل بين حالات البيئة.
Action Model Learning,تعُّلم نموذج الأفعال,مجال فرعي من تعُّلم الآلة، يتعلم فيه وكالء الذكاء الاصطناعي فهم تأثيرات أفعالهم في بيئة ما. .
Action Recognition,تعُّرف على الأفعال,مهمة في رؤية الحاسب ُتحِّلل الفيديوهات لتحديد الأفعال البشرية. وُيطلق عليها أيًضا تعُّرف على الأفعال البشرية     . أو تعُّرف على النشاط البشري. .()
Action Selection,اختيار الفعل,عملية تحديد ما يجب أن يقوم به الوكيل في الخطوة التالية. .
Activation Function,دالة تنشيط,صيغة رياضية ُتستخدم في الشبكة العصبية الاصطناعية؛ لمعالجة الُمْدَخلات الموزونة للُعَقد وتوليد المخرجات. .
Activation Map,خريطة التنشيط,انظر خريطة الخصائص. .
Active Learning,تعُّلم نشط,طريقة تعُّلم شبه موَّجه، يمكن للخوارزمية فيها اختيار بعض البيانات للتعُّلم منها. .
Active Prompting,أوامر نشطة,طريقة لتكييف نموذج على مهام محددة عن طريق اختيار الأسئلة الأكثر غموًضا، وتوصيفها باستخدام أوامر متعلقة بالمهام وتسلسل الأفكار. .
Ad Targeting,توجيه الإعالنات,طريقة إعالنية متقدمة تستهدف الجمهور الأكثر تقب ًال للعروض. وُيطلق عليها أيًضا إعالن موَّجه. . .(  )
AdaGrad ),تدرج َتَكُّيف ّي (أدا جراد,خوارزمية متقدمة للنزول التدرجي، ُتنِّفذ التدرج عن طريق معرفة أشكال البيانات من تكرارات سابقة. .
Adapter Tuning,ضبط الُمكِّيف,أسلوب ضبط دقيق يضيف طبقات صغيرة قابلة للتدريب إلى نموذج ُمدَّرب سابًقا، وُيحِّدث فقط ُمعاِمالت هذه الطبقات؛ لتكييف النموذج على مهام محددة. .
Adaptive Algorithm,خوارزمية َتَكُّيفَّية,خوارزمية تغير سلوكها في وقت التشغيل بناًء على المعلومات المتاحة، والمعايير المحددة سابًقا. .
Adaptive Boosting )AdaBoost(,تعزيز َتَكُّيف ّي,أسلوب تعزيز يجمع بين عدد من المصِّنفات الضعيفة؛ لإنشاء مصِّنف قوي. .
Adaptive Data Governance,َحْوكمة َتَكُّيفَّية للبيانات,طريقة مرنة لحوكمة البيانات، تركز على التعديل المستمر؛ لتلبية التغيرات في احتياجات العمل والمتطلبات التنظيمية والتقنيات. .
Adaptive Machine Learning,تعُّلم الآلة الَّتَكُّيف ّي,طريقة لتحديث نماذج تعُّلم الآلة وإعادة تدريبها تدريجًّيا؛ للَّتَكُّيف مع التغيرات الجديدة. .
Adaptive Neuro-Fuzzy Inference System )ANFIS(,نظام استنتاج عصبي-ضبابي َتَكُّيف ّي,أسلوب يجمع بين المنطق الضبابي والشبكات العصبية؛ لتحسين أداء التنبؤ وقابليته للتطبيق. .
Admissible Heuristic,إرشادية مقبولة,دالة لا تبالغ في تقدير تكلفة الوصول إلى الهدف في خوارزمية البحث. .
Advanced Driver Assistance Systems )ADAS(,أنظمة مساعدة السائق المتقدمة,انظر مساعدة السائق. .
Adversarial Example,مثال عدائي,ُمدخلات ُصِّممت عمًدا لخداع نموذج تعُّلم الآلة، ودفعه الرتكاب الأخطاء. .
Adversarial Machine Learning,تعُّلم الآلة العدائي,مجال يركز على تصميم خوارزميات فاعلة لتعُّلم الآلة؛ ألجل مواجهة التحديات الأمنية. .
Adversarial Prompting,أوامر عدائية,أسلوب لصياغة أوامر مصممة لتضليل النموذج أو التالعب به؛ لإنتاج مخرجات ضارة أو غير مرغوب فيها. .
Affective Computing,حوسبة عاطفية,مجال فرعي من الذكاء الاصطناعي يهتم بتطوير أنظمة قادرة على التعُّرف على المشاعر البشرية ومعالجتها. وُيطلق عليه أيًضا ذكاء اصطناعي عاطفي.   .
Agent,وكيل,كيان مادي أو برمجي يمكنه إدراك بيئته، والعمل بتحكم ذاتي لتحقيق هدف. .
Agent Architecture,معمارية الوكيل,مخطط لنظام التحكم الخاص بالوكيل، يوضح ُمكِّونات التحكم والتنظيم الوظيفي. .
Agglomerative Clustering,تجميع تكُّتلي,طريقة لإنشاء شجرة هرمية عن طريق تعيين كل مثال في مجموعته، ودمج أقرب المجموعات بصورة َتكرارية. .
Algorithm,خوارزمية,مجموعة من التعليمات المحددة لحل مشكلة ما، أو أداء مهمة معينة. .
Algorithm in the Loop,خوارزمية في الحلقة,إطار تعاوني التخاذ القرار، يستفيد من الخوارزميات لتحسين عملية اتخاذ القرار البشري. .
Algorithmic Aversion,نفور من الخوارزميات,الميل البشري إلى تجنب استخدام الخوارزميات أو عدم الثقة فيها؛ حتى عندما تتفوق على الأداء البشري. .
Algorithmic Bias,تحُّيز خوارزمي,انظر تحُّيز الذكاء الاصطناعي. .
Algorithmic Efficiency,كفاءة خوارزمية,مقياس لحساب متوسط الوقت الالزم للخوارزمية لتنفذ العمل كام ًال على مجموعة من البيانات. .
Algorithmic Learning Theory,نظرية التعُّلم الخوارزمي,مجال من مجالات نظرية التعُّلم الحوسبي التي ُتحلل حدود التعُّلم ب ُطُرق غير إحصائية وغير احتمالية. .
Algorithmic Probability,احتمال خوارزمي,طريقة لتعيين احتمالية سابقة للأشياء. وُيطلق عليها أيًضا احتمالية سولومونوف. .    .
Ambient Intelligence )AmI(,ذكاء محيطي,بيئة رقمية مراعية للأشخاص، وداعمة لحياتهم اليومية. .
Analog Artificial Intelligence,ذكاء اصطناعي تناظري,نوع من الذكاء الاصطناعي يستخدم مبادئ الحوسبة التناظرية وأنظمتها؛ لتصميم وتنفيذ خوارزميات ونماذج الذكاء الاصطناعي. .
Analog Data,بيانات تناظرية,بيانات ممثلة بشكل مستمر ومتغير، على عكس البيانات الرقمية التي ُتمَّثل بشكل منفصل وثنائي (أي:  و). .(   ..)
Analog Deep Learning,تعُّلم عميق تناظري,طريقة تستخدم الحوسبة والأجهزة التناظرية إلجراء العمليات الحسابية المطلوبة لمهام التعُّلم العميق. .
Analysis of Algorithms,تحليل الخوارزميات,عملية تحديد التعقيد الحوسبي للخوارزميات وأدائها؛ وذلك من أجل تقييم مدى ملاءمة تطبيقاتها، أو مقارنتها بخوارزميات أخرى. .
Analytics Platform,منصة تحليالت,حل تقني موحد يتيح إجراء الدورة الكاملة لعمليات التحليالت، ويشمل: إعداد البيانات ومعالجتها وتخزينها وإدارتها.
Anchor Box,إطار مرجعي,إطار تحديد بارتفاع وعرض محددين سابًقا، يساعد في اكتشاف الأشياء المتداخلة والأشياء ذات المقاييس المختلفة داخل الصورة. .
Annotator,ُمَوِّصف,عامل يساعد في تسمية البيانات (مثل الصور) عند الطلب. ( ..) ُيطلق عليه أيًضا ُمسِّمي أو ُمقِّيم. .     .
Anomaly Detection,اكتشاف الشذوذ,عملية تحديد المشاهدات غير المعتادة أو غير الطبيعية في البيانات؛ نظًرا لخصائصها المختلفة عن غالبية البيانات المعالجة.
Answer Set Programming )ASP(,برمجة مجموعة الإجابات,نوع من البرمجة التصريحية لحل مشكالت البحث المعقدة. .
Anytime Algorithm,خوارزمية فورية,خوارزمية تعطي نتيجة صالحة حتى لو قوطعت قبل انتهائها، وتتحسن جودة نتائجها تدريجًّيا ما دامت تعمل. .
Application Data Management (ADM),إدارة بيانات التطبيقات,عملية الحوكمة والتأمين والصيانة للبيانات المستخدمة بواسطة تطبيقات برمجية محددة. .
Application Programming Interface )API(,واجهة برمجة التطبيقات,مجموعة من القواعد والبروتوكوالت التي ُتتيح للتطبيقات البرمجية المختلفة التواصل والتفاعل بعضها مع بعض. .
Approximate String Matching,مطابقة تقريبية للسالسل,عملية العثور على تطابق تقريبي للسالسل بدًال من المطابقة التامة. .
Approximation Error,خطأ التقريب,الفرق بين القيمة الحقيقية والقيمة المقدرة بواسطة النموذج. .
Area under the ROC Curve (AUC),مساحة تحت منحنى دّقة الأداء,مقياس أداء ُيستخدم لتقييم قدرة نموذج التصنيف الثنائي على التمييز بين الأصناف الإيجابية والسلبية عبر جميع حدود التصنيف. .
Argumentation Framework,إطار لا ُحجج,شبكة تشتمل على ُعَقد ُتمِّثل الُحجج، وحافات ُتمِّثل التعارضات بين هذه الُحجج. .
Artificial General Intelligence )AGI(,ذكاء عام اصطناعي,نظام حوسبي يمكنه أداء أي مهمة فكرية يمكن للإنسان أداؤها، مثل: حل المشكالت والإبداع والقدرة على الَّتَكُّيف. وُيطلق عليه أيًضا ذكاء اصطناعي عام، أو ذكاء اصطناعي  . قوي، أو ذكاء اصطناعي واسع. .
Artificial Immune System )AIS(,نظام المناعة الاصطناعي,نظام َتَكُّيف ّي لحل المشكالت، مستوحى من جهاز المناعة البشري. .
Artificial Intelligence )AI(,ذكاء اصطناعي,مجال من مجالات علوم الحاسب يركز على بناء أنظمة قادرة على أداء مهام تتطلب عادًة ذكاًء بشرًّيا، مثل: التعُّلم والاستدلال والتطوير الذاتي. وُيطلق عليه أيًضا ذكاء الآلة. . .
Artificial Intelligence Alignment,مواءمة الذكاء الاصطناعي,عملية جعل أنظمة الذكاء الاصطناعي تعمل بطرق تتماشى مع الأهداف والقيم الإنسانية. .
Artificial Intelligence as a Service )AIaaS(,ذكاء اصطناعي كخدمة,خدمة قائمة على السحابة، توفر إمكانات الذكاء الاصطناعي وأدواته، جاهزة لالستخدام من الأفراد والمؤسسات. .
Artificial Intelligence Bias,تحُّيز الذكاء الاصطناعي,تفضيل أو انحياز نظام الذكاء الاصطناعي لمجموعات ما على حساب مجموعات أخرى. وُيطلق عليه أيًضا تحُّيز خوارزمي.    . .
Artificial Intelligence Ethics,أخالقيات الذكاء الاصطناعي,مجموعة من القيم والمبادئ والأساليب لتوجيه السلوك الأخالقي في تطوير تقنيات الذكاء الاصطناعي واستخدامها. .
Artificial Intelligence Governance,حوكمة الذكاء الاصطناعي,السياسات والمبادئ والممارسات التي تضمن التطوير والاستخدام المسؤول والأخالقي والآمن للذكاء الاصطناعي. .
Artificial Intelligence Hallucination,هلوسة الذكاء الاصطناعي,حالة يوِّلد فيها نموذج الذكاء الاصطناعي نتائج غير صحيحة أو مضللة أو غير منطقية. .
Artificial Intelligence Markup Language )AIML(,لغة ترميز الذكاء الاصطناعي,لغة ترميزية مبنية على لغة الترميز الموسعة ()؛ لتطوير  () تطبيقات اللغات الطبيعية. .
Artificial Intelligence Operations )AIOps(,ذكاء اصطناعي للعمليات,تطبيق تقنيات الذكاء الاصطناعي ألتمتة عمليات تشغيل تقنية المعلومات وتحسينها، مثل: المراقبة والتحليل والإدارة. .
Artificial Intelligence Planning,تخطيط الذكاء الاصطناعي,فرع من فروع الذكاء الاصطناعي يهتم باختيار مجموعة من الأفعال المناسبة لتحقيق هدف معين. وُيطلق عليه أيًضا . تخطيط وجدولة مؤتمتة. .
Artificial Intelligence System,نظام ذكاء اصطناعي,نظام قادر على أداء مهام تتطلب عادًة ذكاًء بشرًّيا، مثل: التعُّلم والاستدلال والتطوير الذاتي. .
Artificial Narrow Intelligence )ANI(,ذكاء ضيق اصطناعي,نوع من أنظمة الذكاء الاصطناعي قادر على تنفيذ مهام محددة فقط. وُيطلق عليه أيًضا ذكاء اصطناعي ضيق أو      . ذكاء اصطناعي ضعيف. .    ()
Artificial Neural Network )ANN(,شبكة عصبية اصطناعية,نموذج حوسبي في الذكاء الاصطناعي مستوحى من الشبكات العصبية البيولوجية ألدمغة الحيوانات. وُيطلق عليه أيًضا  . شبكة عصبية. .()
Artificial Neuron,خلية عصبية اصطناعية,انظر خلية عصبية. .
Artificial Superintelligence )ASI(,ذكاء اصطناعي خارق,انظر ذكاء خارق. .
Artificial Synapse,ناقل عصبي اصطناعي,انظر ناقل عصبي. .
Association for the Advancement of Artificial,جمعية النهوض بالذكاء الاصطناعي,() جمعية علمية غير ربحية ُمكَّرسة للنهوض بالبحث العلمي، والتثقيف العام، وتدريب الممارسين، والحث على الاستخدام المسؤول للذكاء الاصطناعي. .
Associative Learning,تعُّلم ترابطي,أسلوب من أساليب تعُّلم الآلة قائم على قواعد الكتشاف العلاقات المهمة بين الخصائص أو المتغيرات في مجموعة البيانات. .
Attention Mechanism,آلية الانتباه,انظر نموذج الانتباه. .
Attention Model,نموذج الانتباه,أسلوب في الشبكة العصبية ُيتيح للشبكة التركيز على جانب واحد من الُمْدَخلات المعقدة في كل مرة حتى ُتصَّنف مجموعة البيانات بأكملها. وُيطلق عليه أيًضا آلية الانتباه. . .
Attribute,سمة,صفة أو ميزة لشيء ما بمقدور البشر أو الطرق المؤتمتة التعُّرف عليها، وغالًبا ما تستخدم كمرادف لكلمة خاصية.  . .
Audio Signal Processing,معالجة الإشارات الصوتية,مجال فرعي من معالجة الإشارات يركز على تحليل الإشارات الصوتية ومعالجتها. .
Auditability,قابلية التدقيق,القدرة على مراجعة البيانات والعمليات واتخاذ القرارات في نظام الذكاء الاصطناعي وتقييمها؛ لضمان الشفافية والمساءلة. .
Augmented Analytics,تحليالت ُمَعَّززة,استخدام تقنيات الذكاء الاصطناعي ألتمتة عمليات تحليالت البيانات، مثل: إعداد البيانات واكتشاف الرؤى. .
Augmented Data Quality,جودة البيانات الُمَعَّززة,استخدام تقنيات الذكاء الاصطناعي ألتمتة عمليات جودة البيانات، وتحسين دقة البيانات واتساقها وموثوقيتها. .
Augmented Intelligence,ذكاء ُمعَّزز,نمط تصميمي ُيكِّمل الذكاء البشري، ويساعد البشر ليكونوا أذكى وأسرع في أداء المهام. وُيطلق عليه أيًضا تعزيز الذكاء. . .
Augmented Research,بحث ُمعَّزز,تطبيق الذكاء الاصطناعي في تحليل البيانات واختبار الفرضيات؛ لدعم البحث في المجالات المختلفة. .
Auto-Regressive Model,نموذج انحدار ذاتي,نموذج يتنبأ بالقيم المستقبلية بناًء على القيم السابقة. .
Autoencoder,ُمرِّمز تلقائي,نوع من الشبكات العصبية الاصطناعية ُيستخدم لإنتاج تمثيالت بيانات فاعلة للتعُّلم غير الموَّجه. .
Automated Journalism,صحافة مؤتمتة,انظر صحافة روبوتية. .
Automated Machine Learning )AutoML(,تعُّلم الآلة المؤتمت,عملية أتمتة مهام تعُّلم الآلة؛ لبناء النماذج وتدريبها واختبارها ونشرها. .
Automated Planning and Scheduling,تخطيط وجدولة مؤتمتة,انظر تخطيط الذكاء الاصطناعي. .
Automated Reasoning,استدلال مؤتمت,عملية توفر إطاًرا منظًما لخوارزميات تعُّلم الآلة؛ ألجل تحديد المشكالت وحلها. .
Automated Vehicle,مركبة مؤتمتة,انظر مركبة ذاتية التحكم. .
Automatic Speech Recognition )ASR(,تعُّرف تلقائي على الكالم,انظر تعُّرف على الكالم. .
Automatic Summarization,تلخيص تلقائي,عملية اختصار جزء من اللغات الطبيعية مع الحفاظ على الدلالات المهمة. .
Automation,أتمتة,عملية أو نظام يعمل دون تدخل بشري. .
Automation Bias,تحُّيز الأتمتة,تفضيل صانع القرار البشري التوصيات التي ينتجها نظام صنع قرار مؤتمت على المعلومات التي ُتنَتج بدون أتمتة، حتى عندما يرتكب نظام صنع القرار المؤتمت أخطاء.
Autonomic Computing,حوسبة ذاتية,قدرة النظام على إدارة موارده دون تدخل المستخدم. .
Autonomous Car,سيارة ذاتية التحكم,انظر سيارة ذاتية القيادة. .
Autonomous Driving,قيادة ذاتية,عملية استشعار المحيط والتحرك بتحكم واكتفاء ذاتي. .
Autonomous Robot,روبوت ذاتي التحكم,روبوت يؤدي المهام بدرجة عالية من التحكم الذاتي. .
Autonomous System,نظام ذاتي التحكم,نظام يعمل بتحكم ذاتي، ويؤدي المهام، ويتخذ القرارات دون تدخل بشري. .
Autonomous Vehicle,مركبة ذاتية التحكم,مركبة قادرة على استشعار محيطها والتحرك بتحكم واكتفاء ذاتي. وُيطلق عليها أيًضا مركبة مؤتمتة.  . .
Autonomy,تحكم ذاتي,قدرة النظام على العمل وفًقا لقواعده و ُطُرق تعُّلمه. .
Autoregressive Model,نموذج الانحدار الذاتي,نموذج يتنبأ بالقيمة المستقبلية لمتغير ما، بناًء على ِقَيمه السابقة. .
Availability,توُّفر,خاصية إمكانية الوصول عند الطلب من كيان معتمد. .
Average Linkage,ربط متوسط,طريقة تجميع تحسب المسافة بين مجموعتين عن طريق متوسط المسافة بين جميع أزواج نقاط البيانات من كل مجموعة. .
Average Precision,متوسط الإحكام,مقياس يلخص أداء تسلسل ُمرَّتب للنتائج عن طريق حساب متوسط قيم الدقة لكل نتيجة ذات صلة. .
Backpropagation,انتشار عكسي,خوارزمية ُتستخدم عند تدريب الشبكات العصبية الاصطناعية لتقليل الأخطاء عن طريق إيجاد قيمة التدرج المطلوب لحساب أوزان الشبكة. .
Backpropagation Through Time )BPTT(,انتشار عكسي عبر الزمن,طريقة لتطبيق الانتشار العكسي على الشبكات العصبية التكرارية. .
Backward Chaining,تسلسل خلفي,طريقة استدلال منطقي تعمل بطريقة عكسية؛ من الهدف إلى تحديد البيانات أو الإثباتات المؤِّيدة لذلك الهدف. .
Bag of Words,حقيبة كلمات,تمثيل للكلمات في نص يصف تكرارها داخل مستند، بغض النظر عن ترتيبها. .
Baseline Model,نموذج أساس,نموذج مرجعي ُيستخدم لمقارنة مدى جودة أداء نموذج آخر أكثر تعقيًدا في مشكلة معينة. .
Batch,ُحزمة,مجموعة من الأمثلة المستخدمة لتدريب النموذج. .
Batch Inference,استنتاج ُحَزمي,انظر استنتاج غير مباشر. .
Batch Normalization,تسوية لا ُحزمة,أسلوب تعُّلم موَّجه لتحسين أداء الشبكة العصبية واستقرارها عن طريق تحويل مخرجات الطبقة البينية إلى صيغة موحدة. .
Batch Processing,معالجة لا ُحزمة,معالجة مجموعة من البيانات أو البرامج بأقل قدر من التفاعل البشري. .
Batch Size,حجم لا ُحزمة,عدد العِّينات التي ُتمَّرر إلى نموذج تعُّلم الآلة في كل تكرار لتدريب النموذج. .
Bayes's Law,قانون بايز,انظر نظرية بايز. .
Bayes’s Rule,قاعدة بايز,انظر نظرية بايز. .
Bayes's Theorem,نظرية بايز,صيغة رياضية لحساب الاحتمالات الشرطية التي تصف احتمالية وقوع حدث ما، بناًء على حدث سابق. وُيطلق عليها أيًضا قانون بايز أو قاعدة بايز.    . .
Bayesian Network,شبكة بايزية,نموذج شبكي يمثل المتغيرات وتوابعها الشرطية باستخدام الاستنتاج البايزي. .
Bayesian Neural Network,شبكة عصبية بايزية,شبكة عصبية احتمالية تعتمد على نظرية بايز لحساب أوجه عدم التيقن في الأوزان والمخرجات. .
Bayesian Programming,برمجة بايزية,طريقة إحصائية لبناء نماذج احتمالية، وحل المشكالت المفتوحة ذات المعلومات غير المكتملة. .
Bees Algorithm,خوارزمية النحل,خوارزمية تحاكي سلوك أسراب النحل في العثور على الغذاء عن طريق البحث العشوائي، ويمكن استخدامها لحل مشكالت التحسين. .
