English Term,Arabic Term,Arabic Description
Convolutional Neural Network )CNN(,شبكة عصبية ترشيحية,نوع من الشبكات العصبية العميقة المستخدمة في إنشاء نماذج لتحليل الصور والفيديوهات ومعالجتها. .
Convolutional Operation,عملية ترشيحية,عملية حسابية لضرب شريحة من مصفوفة الُمْدَخلات والُمرِّشح، ثم جمع كل القيم في المصفوفة الناتجة. .
Convolutional Stride,خطوة ترشيحية,حجم خطوة تحريك الُمر ِّشحات. .
Coreference Resolution,تحديد المرجع,مهمة في معالجة اللغات الطبيعية تتضمن تحديد كل التعبيرات  () التي تشير إلى نفس الكيان في النص. .
Corpus,مدونة,مجموعة كبيرة مهيكلة من البيانات النصية أو الصوتية. .
Correlation,ارتباط,مقياس إحصائي لمدى الارتباط الرياضي بين متغيرين. .
Cost Function,دالة التكلفة,انظر دالة الخسارة. .
Counterfactual Explanation,تفسير مغاير,طريقة ُتستخدم لشرح القرارات التي تتخذها نماذج تعُّلم الآلة؛ عن طريق وصف التغييرات في البيانات الُمْد َخلة التي من الممكن أن تؤدي إلى نتائج مختلفة. .
Counterfactual Fairness,إنصاف مغاير,مقياس إنصاف ُيقِّيم ما إذا كان الُمصِّنف يعطي نفس النتيجة ألفراد متطابقين إال في سمة حساسة أو أكثر. .
Covariance,تباين,مقياس لمدى التباين بين متغيرين غير مرتبطين ببعضهما. .
Coverage Bias,تحُّيز التغطية,نوع من تحُّيز الاختيار لا ُتمِّثل فيه البيانات المختارة مجموعة العينة المستهدفة. .
Cross-Entropy Loss,خسارة الإنتروبيا التقاطعية,انظر خسارة لوغاريثمية. .
Cross-Validation,تحقق تقاطعي,آلية لتقييم تعميم النموذج على البيانات الجديدة؛ عن طريق اختبار النموذج على مجموعة فرعية واحدة أو أكثر، مأخوذة من مجموعة التدريب. .
Curriculum Learning,تعُّلم منهجي,إستراتيجية تدريب في تعُّلم الآلة، ُتدِّرب النماذج على البيانات بتسلسل ذي معنى، بدًءا من الأمثلة الأسهل، ثم التقدم تدريجًّيا إلى الأمثلة الأكثر صعوبة. .
Custom Estimator,مقِّدر مخ َّصص,مقِّدر مصَّمم التباع توجيهات محددة. .
Custom Model,نموذج مخ َّصص,نموذج يقبل الُمْدَخلات الخاصة بمستخدم ما، وُيعطي تنبؤات بناًء على تلك الُمْدَخلات. .
Custom Training,تدريب مخ َّصص,عملية تدريب النموذج على القيام بتنبؤات معينة. .
Dark Data,بيانات مظلمة,البيانات التي تجمعها المؤسسات وتعالجها وتخزنها أثناء أنشطة الأعمال العادية، ولكنها لا تستخدمها في أغراض أخرى. .
Dashboard,لوحة معلومات,واجهة مستخدم رسومية تجمع المعلومات والتصويرات لعرض المقاييس أو المعايير أو المؤشرات التي تساعد في المراقبة واتخاذ القرار. .
Data,بيانات,تمثيل للمعلومات بصيغة مناسبة للتخزين أو المعالجة أو النقل. .
Data Aggregation,تجميع البيانات,عملية جمع البيانات من عدة مصادر للتحليل أو إعداد التقارير، وتشمل تجميع البيانات أو تلخيصها عن طريق عمليات حسابية، مثل: حساب المجموع أو المتوسط أو الحد الأدنى أو الحد الأقصى. .
Data Analysis,تحليل البيانات,فحص منهجي للبيانات عن طريق العِّينات والقياس والتصوير. .
Data Analytics,تحليالت البيانات,مفهوم يضم عمليات جمع البيانات والتحقق من صحتها ومعالجتها وتصويرها؛ ألجل اكتشاف رؤى مفيدة في اتخاذ القرار. .
Data Annotation,توصيف البيانات,عملية إضافة معلومات وصفية إلى مجموعة البيانات؛ الستخدامها كُمدخلات لنموذج تعُّلم الآلة. وُيطلق عليها أيًضا تسمية البيانات أو تسمية.      . .
Data Anonymization,إخفاء بيانات الهوية,عملية تعديل معلومات التعريف الشخصية أو إزالتها من مجموعات البيانات؛ لحماية خصوصية الأفراد. .
Data Augmentation,زيادة البيانات,أسلوب في تعُّلم الآلة لإنشاء بيانات جديدة عن طريق معالجة البيانات الأصلية. .
Data Center,مركز البيانات,مكان يضم مجموعة من الخوادم وأجهزة تخزين البيانات مع اتصال عالي السرعة؛ لإدارة تطبيقات المؤسسة وبياناتها.
Data Classification,تصنيف البيانات,عملية تعيين فئات أو أسماء للبيانات بناًء على محتواها أو حساسيتها أو معايير أخرى؛ لتحسين التنظيم والأمن والامتثال.
Data Cleansing )or Data Cleaning(,تنظيف البيانات,عملية تصحيح الأخطاء والتناقضات وعدم الدقة في مجموعات البيانات. وُيطلق عليها أيًضا تنقية البيانات.    . .
Data Collection,جمع البيانات,عملية جمع البيانات وقياسها، وتشمل الحصول عليها وتسميتها وتحسينها. .
Data Control,تحكم في البيانات,السياسات والإجراءات والأدوات المستخدمة لإدارة البيانات وحمايتها طوال دورة حياتها. .
Data Custodian,أمين البيانات,شخص أو مؤسسة مسؤولة عن توفير البنية التحتية لتقنية المعلومات وحماية البيانات وفًقا لسياسات حوكمة البيانات وممارساتها. .
Data Dredging,تالعب بالبيانات,تحُّيز إحصائي يحدث عند التالعب بالبيانات أو تحليلها بطريقة مفرطة للوصول إلى نتائج ذات دلالة إحصائية مع أنها قد لا تكون كذلك. ُيطلق عليه أيًضا تطُّفل على البيانات أو تصُّيد في البيانات أو قرصنة القيمة الاحتمالية.      . .
Data Drift,انحراف البيانات,تغيير في توزيع البيانات الُمْد َخلة في النموذج، يحدث مع مرور الوقت؛ وقد يؤدي إلى انخفاض أداء النموذج. ُيطلق عليه أيًضا تغُّير البيانات. .    .
Data Engineering,هندسة البيانات,مجال يركز على التصميم والبناء والصيانة للبنية التحتية والأنظمة الالزمة لدعم جمع كميات كبيرة من البيانات ومعالجتها وتخزينها وتحليلها. .
Data Ethics,أخالقيات البيانات,المبادئ والمعايير التي تحكم جمع البيانات ومعالجتها ومشاركتها واستخدامها. .
Data Exhaust,بيانات ثانوية,أي معلومات تنتج بطريقة ثانوية من الأنشطة الرقمية. .
Data Exploration,استكشاف البيانات,انظر تحليل البيانات الاستكشافي. .()
Data Fabric,نسيج البيانات,معمارية لإدارة البيانات وتكاملها، توفر إمكانات متسقة عبر بيئات متعددة. .
Data Feed,تغذية البيانات,طريقة لتزويد المستخدمين ببيانات ُمَحَّدثة من مصادر البيانات. .
Data Fishing,تصُّيد في البيانات,انظر تالعب بالبيانات. .
Data Fusion,دمج البيانات,عملية دمج البيانات من مصادر مختلفة لتوفير معلومات أكثر اتساًقا ودقة. .
Data Governance,حوكمة البيانات,السياسات والعمليات والهياكل التنظيمية التي تحدد حقوق اتخاذ القرار ومسؤوليات دعم إدارة البيانات. .
Data Harmonization,تنسيق البيانات,عملية دمج البيانات المتباينة في صيغة متسقة لتسهيل الوصول إليها وتحليلها. .
Data Hub,ِم ْحَور البيانات,مستودع مركزي لجمع البيانات من مصادر متعددة وتخزينها وإدارتها ومشاركتها. .
Data Hygiene,نظافة البيانات,عملية الحفاظ على بيانات دقيقة كاملة متسقة داخل نظام أو قاعدة بيانات. .
Data Instance,عينة بيانات,تحديد عنصر بيانات من نوع بيانات أو مجموعة بيانات. .
Data Integration,تكامل البيانات,عملية دمج لبيانات من مصادر مختلفة، في عرض موحد وواضح للمستخدمين. .
Data Integrity,صحة البيانات,مقياس ثقة للتحقق من دقة البيانات واكتمالها واتساقها وامتثالها للوائح. .
Data Intelligence,ذكاء البيانات,استخدام تقنيات الذكاء الاصطناعي لتحليل البيانات وتفسيرها. .
Data Labeling,تسمية البيانات,انظر توصيف البيانات. .
Data Lake,بحيرة البيانات,مستودع لتخزين كميات كبيرة من البيانات الأولية بصيغ مختلفة. .
Data Lakehouse,مستودع بحيرة البيانات,معمارية بيانات تجمع بين أفضل ميزات بحيرة البيانات ومستودع البيانات في منصة واحدة. .
Data Leakage,تسُّرب البيانات,حالة في تعُّلم الآلة ُتستخدم فيها معلومات من خارج مجموعة بيانات التدريب لإنشاء النماذج؛ وهو ما يؤدي إلى تقديرات أداء غير دقيقة. .
Data Literacy,إلمام بالبيانات,القدرة على فهم البيانات وتحليلها وتوصيلها بصورة فاعلة، واتخاذ قرارات مستنيرة تعتمد على رؤى مبنية على البيانات. .
Data Loading,تحميل البيانات,عملية استيراد أو نقل أو دمج البيانات من مصادر مختلفة في نظام تخزين واحد، مثل قاعدة بيانات أو مستودع بيانات. .
Data Marketplace,سوق البيانات,منصة إلكترونية عمُلها الرئيس توفير البيانات أو أي خدمات ذات صلة، كما تسمح بشراء وبيع البيانات القابلة للقراءة آلًّيا. .
Data Mart,متجر البيانات,مجموعة فرعية من مستودع البيانات تركز على أنواع معينة من الأعمال أو الموضوعات. .
Data Masking,إخفاء البيانات,عملية تعتيم المعلومات الحساسة عن طريق استبدالها ببيانات وهمية ولكنها واقعية المظهر. ُيطلق عليها أيًضا تشويش البيانات. .    .
Data Migration,ترحيل البيانات,عملية نقل البيانات من نظام إلى آخر. .
Data Mining,تنقيب في البيانات,عملية اكتشاف الأنماط في كمية كبيرة من البيانات، واستخراج المعلومات المفيدة. .
Data Model,نموذج البيانات,مجموعة من الطرق المفاهيمية لوصف البيانات، ودلالاتها، والعلاقات بينها، وقيود الاتساق. .
Data Modelling,نمذجة البيانات,عملية إنشاء تمثيل مفاهيمي للبيانات وعلاقاتها؛ ألجل تخزينها في قاعدة البيانات. .
Data Obfuscation,تشويش البيانات,انظر إخفاء البيانات. .
Data Observability,قابلية مراقبة البيانات,القدرة على مراقبة صحة البيانات وفهمها والحفاظ عليها؛ لضمان دقتها واتساقها وموثوقيتها. .
Data Operations )DataOps(,عمليات البيانات,ممارسة لإدارة البيانات تستخدم منهجية رشيقة وتعاونية؛ لتبسيط دورة الحياة لتحليالت البيانات، وتحسين جودتها. .
Data Owner,مالك البيانات,شخص أو أكثر، مسؤول عن بيانات معينة. .
Data Parallelism,توازي البيانات,أسلوب ُيستخدم لتسريع التدريب أو الاستنتاج عن طريق تكرار النموذج على عدة أجهزة، ثم تقسيم البيانات الُمْدَخلة على هذه الأجهزة. .
Data Pipeline,سير عمل البيانات,سلسلة من العمليات التي تنقل البيانات الخام وتحِّولها من مصادر مختلفة إلى وجهة للتحليل أو الاستخدام. .
Data Point,نقطة بيانات,جزء منفصل من المعلومات المشتقة من مجموعة بيانات أكبر. .
Data Poisoning,تسميم البيانات,هجوم أمني يقوم فيه المهاجم بإدخال بيانات خاطئة أو مضللة في مجموعة بيانات التدريب؛ إلفساد سلوك النموذج أو التأثير عليه. .
Data Processing,معالجة البيانات,مجموعة واسعة من العمليات التي يمكن إجراؤها على البيانات بوسائل يدوية أو مؤتمتة. .
Data Profiling,استخلاص البيانات,عملية فحص البيانات، وإعداد ملخصات وافية عنها. .
Data Proxy,بيانات بديلة,البيانات التي تحل محل البيانات المفقودة أو التي لا يمكن الوصول إليها أو قياسها، وذلك باستخدام بيانات ذات صلة من عمليات أو أنشطة مماثلة. .
Data Quality,جودة البيانات,مقياس لمدى فائدة البيانات وملاءمتها للغرض المقصود، ويشمل الاكتمال والاتساق والدقة. .
Data Redaction,تنقيح البيانات,عملية إزالة المعلومات الحساسة أو تعتيمها بشكل انتقائي من مستند أو مجموعة بيانات؛ لحمايتها من الوصول غير المصَّرح به. .
Data Replication,تكرار البيانات,تكرار البيانات على عدد من أجهزة الحاسب داخل نظام موَّزع؛ لضمان مستوى الاتساق في الوصول إلى المعلومات. .
Data Representation,تمثيل البيانات,الشكل الذي يمثل كيفية تخزين البيانات ومعالجتها ونقلها. .
Data Sampling,أخذ عِّينات البيانات,عملية اختيار مجموعة فرعية من عِّينات البيانات ُتمِّثل مجموعة بيانات أكبر؛ ألجل تحليل الأنماط والاتجاهات. .
Data Science,علم البيانات,مجال يركز على استخراج معلومات مفيدة ورؤى من البيانات عن طريق الاكتشاف أو اختبار الفرضيات. .
Data Scientist,عاِلم بيانات,شخص متخصص في تحليالت البيانات، ولديه مهارات فنية لحل المشكالت المعقدة باستخدام أدوات علم البيانات وأساليبها. .
Data Scrubbing,تنقية البيانات,انظر تنظيف البيانات. .(  )
Data Security Governance,حوكمة أمن البيانات,السياسات والإجراءات والضوابط التي تضمن حماية البيانات. .
Data Seeding,بذر البيانات,عملية إدخال البيانات الأولية في قاعدة البيانات لتسهيل الاختبار أو التطوير. .
Data Shift,تغُّير البيانات,انظر انحراف البيانات. .
Data Snooping,تطُّفل على البيانات,انظر تالعب بالبيانات. .
Data Source,مصدر البيانات,المكان الذي تنشأ منه البيانات، ويمكن استرجاعها للتحليل أو المعالجة. .
Data Steward,مشرف البيانات,دور وظيفي في إدارة البيانات يتضمن تنفيذ سياسات حوكمة البيانات والحفاظ عليها داخل المؤسسة. .
Data Storytelling,سرد قصصي للبيانات,ممارسة توصيل الرؤى المستمدة من البيانات عن طريق السرد والتصوير لجعل المعلومات المعقدة أكثر تأثيًرا وقابلية للفهم.
Data Structure,هياكل البيانات,طريقة لتنظيم البيانات وتخزينها في ذاكرة الحاسب للوصول إليها ومعالجتها بكفاءة. .
Data Subject,صاحب البيانات الشخصية,الفرد الذي تتعلق به البيانات الشخصية. .
Data Variability,تباين البيانات,التغُّيرات في مجموعات البيانات من جانب معدل الإرسال أو الصيغة أو الدلالات أو الجودة. .
Data Variety,تنُّوع البيانات,اختالف أنواع البيانات وصَيغها، مثل: البيانات المهيكلة وشبه المهيكلة وغير المهيكلة. .
Data Velocity,سرعة البيانات,معدل سرعة إنشاء البيانات أو إرسالها أو تخزينها أو تحليلها أو تصويرها. .
Data Veracity,موثوقية البيانات,دقة البيانات واكتمالها. .
Data Visualization,تصوير البيانات,تمثيل رسومي للمعلومات يسلط الضوء على الأنماط والاتجاهات في البيانات، ويساعد القارئ على اكتساب رؤى سريعة. .
Data Volatility,تقُّلب البيانات,خصائص البيانات المتعلقة بمعدل تغيرها بمرور الوقت. .
Data Volume,حجم البيانات,كمية البيانات التي تؤِّثر في موارد المعالجة والتخزين وفي إدارتها أيًضا. .
Data Warehouse,مستودع البيانات,مستودع مركزي لبيانات ُجمعت من مصادر متعددة؛ لدعم تحليل البيانات. .
Data Wrangling,تجهيز البيانات,عملية لتنظيف البيانات وتحويلها وتنظيمها إلى صيغة قابلة لالستخدام في التحليل أو النمذجة. .
Data-Centric Artificial Intelligence,ذكاء اصطناعي مرتكز على البيانات,طريقة تركز على التحسين المنهجي لبيانات التدريب؛ لتعزيز أداء نماذج الذكاء الاصطناعي. .
Data-Driven Decision-Making (DDDM),اتخاذ قرار مبني على البيانات,عملية اتخاذ القرارات بناًء على البيانات بدًال من مجرد الحدس أو المالحظة. وُيطلق عليها أيًضا اتخاذ قرار مستند إلى البيانات.   . .()
Data-Informed Decision-Making )DIDM(,اتخاذ قرار مستند إلى البيانات,انظر اتخاذ قرار مبني على البيانات. .()
Database,قاعدة البيانات,مجموعة من البيانات المن َّظمة وفًقا لهيكل مفاهيمي بغرض دعم التطبيقات في مجال معين. .
Database Administrator (DBA),مدير قاعدة البيانات,شخص ُيدير قواعد البيانات وأنظمتها، وهو مسؤول عن صيانتها. .
Database as a Service (DBaaS),قاعدة البيانات كخدمة,منصة تتيح استخدام وظائف قواعد البيانات على السحابة. .
Database Normalization,تسوية قاعدة البيانات,عملية تصميم البيانات في قاعدة بيانات عن طريق إنشاء علاقات بين الجداول؛ إلزالة التكرار والتبعية غير المتسقة. .
Database Query,استعلام قاعدة البيانات,طلب استرجاع البيانات المخَّزنة في قاعدة البيانات أو معالجتها أو إدارتها. .
Database Schema,مخطط قاعدة البيانات,التصميم العام لقاعدة البيانات. .
Dataframe,إطار البيانات,نوع بيانات ُيستخدم لتمثيل مجموعات البيانات. .
Datalog,داتا لوج,لغة برمجة منطقية تصريحية تتضمن مجموعة محدودة من الحقائق والقواعد، ويمكن استخدامها في قواعد البيانات الاستنباطية. .
Dataset )or Data Set(,مجموعة البيانات,مجموعة من البيانات التي يمكن الوصول إليها بصيغة واحدة أو أكثر. .
Datatype )or Data Type(,نوع البيانات,مجموعة محددة من البيانات التي لها هياكل محددة ومجموعة من العمليات الُمتاحة. .
Decentralized Artificial Intelligence,ذكاء اصطناعي لا مركزي,انظر ذكاء اصطناعي موَّزع. .()
Decision Analysis,تحليل القرار,طريقة معيارية التخاذ الخيارات المثلى في ظل ظروف غير مؤكدة. .
Decision Boundary,حدود القرار,الفاصل بين الأصناف التي تعلمها النموذج في مشكالت التصنيف الثنائي أو المتعدد. .
Decision Support System )DSS(,نظام دعم القرار,نظام معلومات يساعد في تقييم البدائل وحل المشكالت واتخاذ القرارات. .
Decision Theory,نظرية القرار,دراسة الاستدلال الكامن وراء الاختيارات والقرارات في ظل عدم التيقن. .
Decision Threshold,حد القرار,انظر حد التصنيف. .
Decision Tree,شجرة القرار,خوارزمية تعُّلم موَّجه تستخدم رسوًما بيانية شجرية؛ إلجراء عمليات تحليل القرار. .
Decision Tree Learning,تعُّلم شجرة القرار,عملية بناء شجرة قرار من البيانات ألداء مهام التصنيف أو الانحدار. .
Decoder,مفِّكك ترميز,نظام تعُّلم آلة ُيحِّول التمثيل المعاَلج إلى تمثيل خام. .
Deconvolution,تفكيك الترشيح,انظر ترشيح معكوس. .
Deconvolutional Neural Network (DNN),شبكة عصبية ترشيحية عكسية,شبكة عصبية تعمل بطريقة معاكسة لطريقة عمل الشبكة العصبية الترشيحية. .
Deduction,استنباط,انظر استدلال استنباطي. .
Deductive Analytics,تحليالت استنباطية,نوع من تحليالت البيانات، يبدأ بنظرية عامة أو فرضية، ثم يختبرها ببيانات محددة للوصول إلى نتيجة ما. .
Deductive Classifier,ُمصِّنف استنباطي,نوع َتَكُّيف ّي من ُمَحِّركات الاستنتاج ُيستخدم لتحسين دقة التصنيف. .
Deductive Reasoning,استدلال استنباطي,عملية استخلاص الاستنتاجات بناًء على بيانات أو حقائق عامة مقبولة على أنها صحيحة. وُيطلق عليها أيًضا استنباط. .   .
Deep Belief Network,شبكة الاعتقاد العميق,نوع من الشبكات العصبية العميقة التي تتكون من طبقات متعددة من المتغيرات العشوائية الكامنة. .
Deep Blue,ديب بلو,حاسب عمالق فاز على بطل العالم في لعبة الشطرنج جاري كاسباروف عام م. .
Deep Learning,تعُّلم عميق,مجال فرعي من تعُّلم الآلة يستخدم عدة طبقات مخفية في الشبكات العصبية لحل المشكالت المعقدة عن طريق تحديد أهم الخصائص الأساسية للبيانات الُمْدَخلة. .
Deep Model,نموذج عميق,انظر شبكة عصبية عميقة. .()
Deep Neural Network )DNN(,شبكة عصبية عميقة,نوع من الشبكات العصبية الاصطناعية يشتمل على عدة  () طبقات بين طبقتي الُمدخلات والمخرجات. وُيطلق عليه أيًضا نموذج عميق. .    .
Deep Q-Network )DQN(,شبكة كيو العميقة,خوارزمية تجمع بين التعُّلم التعزيزي والشبكات العصبية العميقة لحل المشكالت المعقدة، والتعامل مع البيئات الكثيرة الأبعاد.
Deepfake,تزييف عميق,نوع من الوسائط المصطنعة التي توضع فيها صورة شخص أو صوته بدًال من صورة شخص آخر أو صوته. .
