English Term,Arabic Term,Arabic Description
Prompt Chaining,تسلسل الأوامر,أسلوب يتضمن تقسيم مهمة معقدة إلى سلسلة من الأوامر، ويكون مخرج الأمر الأول ُمْدَخ ًال للأمر الذي يليه.
Prompt Design,تصميم الأوامر,عملية صياغة الأوامر بطريقة فاعلة لتوجيه مخرجات وسلوك النماذج. .
Prompt Distillation,تقطير الأوامر,أسلوب ُيستخدم لتبسيط الأوامر وتحسينها، عن طريق تقليل أطوالها، مع الحفاظ على قدراتها في الحصول على الاستجابات المطلوبة. .
Prompt Engineering,هندسة الأوامر,عملية تصميم الأوامر المعطاة للنماذج وتنقيحها وتحسينها لتحقيق المخرجات المطلوبة. .
Prompt Injection,حقن الأوامر,نوع من الهجوم السيبراني على نموذج، عن طريق التالعب بالُمْدَخلات المقدمة له بطريقة تنتج مخرجات غير مرغوبة. .
Prompt Tuning,ضبط الأوامر,أسلوب لتكييف نموذج ما على مهام محددة، عن طريق ضبط الأوامر الُمْدَخلة، بدًال من تعديل ُمعاِمالت النموذج. .
Prompt-Based Learning,تعُّلم قائم على الأوامر,انظر تعُّلم سياقي. .
Proximal Policy Optimization (PPO),تحسين السياسة الأقرب,خوارزمية للتعُّلم الُمَعَّزز ُتدِّرب الوكيل على تحقيق مهام معقدة، عن طريق تحسين دالة هدف بديلة لتقييد حجم الخطوة في كل تحديث للسياسة. .
Proxy Attribute,سمة بالوكالة,سمة ُتستخدم كبديل لسمة حساسة. .
Proxy Label,اسم بالوكالة,البيانات الخاصة بتقريب الأسماء غير المتوفرة مباشرة في مجموعة البيانات. .
Pruning,تشذيب,عملية تنظيف الأكواد أو النماذج إلزالة الحلول غير المرغوب فيها، وتسهيل صيانة الكود. .
Pseudo-Labeling,تسمية مستعارة,أسلوب في التعُّلم الشبه الموَّجه ُينشئ النموذج فيه أسماء للبيانات غير الُمسَّماة، ثم ُتستخدم هذه الأسماء لتدريب النموذج بشكل أكبر. .
Pseudonymization )or Pseudo-Anonymization(,تبديل بيانات الهوية,عملية وضع بيانات مستعارة بدًال من معلومات التعريف الشخصية الموجودة في مجموعة البيانات. .
Python,بايثون,لغة برمجة عالية المستوى ُتستخدم ألغراض متعددة، وقد لقيت رواًجا متزايًدا في علم البيانات وتعُّلم الآلة. .
Q-Function,دالة كيو,دالة في التعُّلم التعزيزي تتنبأ بالعائد عند القيام بفعل معين في حالة ما وعند سياسة معينة. وُيطلق عليها أيًضا دالة قيمة الحالةالفعل.    . .
Q-Learning,خوارزمية كيو,خوارزمية تعُّلم تعزيزي ُتتيح للوكيل التعُّلم والعمل على النحو الأمثل في مجالات محكومة. .
Qualification Problem,مشكلة التأهيل,مشكلة تحديد الشروط السابقة للفعل في حالة معينة. .
Quantile,نقطة تجزيء,نقطة فصل تقسم توزيع الاحتمالات إلى فترات متواصلة باحتمالات متساوية. .
Quantile Bucketing,تجميع كمي,عملية توزيع قيم الخاصية في مجموعات بطريقة يكون فيها لكل مجموعة نفس عدد الحالات تقريًبا. .
Quantization,تجزيء كمي,خوارزمية تطبق التجميع الكمي على خاصية معينة في مجموعة البيانات. .
Quantum Computing,حوسبة الكم,مجال ناشئ في علوم الحاسب يستخدم ظواهر ميكانيكا الكم ألغراض حوسبية. .
Quantum Machine Learning,تعُّلم الآلة بالكم,مجال يجمع بين حوسبة الكم وخوارزميات تعُّلم الآلة لمعالجة البيانات وحل المشكالت المعقدة بكفاءة أكبر. .
Query Analysis,تحليل الاستعلام,عملية ُتستخدم في قواعد البيانات لتحليل الاستعلام وتحسين أدائه. .
Query Language,لغة استعلام,لغة مستخدمة للوصول إلى المعلومات المخَّزنة في قاعدة البيانات. .
Query Routing,توجيه الاستعلام,عملية توجيه الاستعلامات إلى مصادر البيانات المناسبة السترداد المعلومات الأكثر صلة. .
Question Answering )QA(,إجابة الأسئلة,عملية تحديد أنسب إجابة لسؤال ما باللغة الطبيعية. .
Question Decomposition,تفكيك الأسئلة,عملية تقسيم السؤال المعقد أو المركب إلى أسئلة فرعية أبسط يمكن معالجتها. .
R Language,لغة آر,لغة برمجة عالية المستوى ُتستخدم على نطاق واسع للتحليل الإحصائي وتعُّلم الآلة. .
Radial Basis Function )RBF(,دالة القاعدة الشعاعية,دالة تشتمل على قيم تعتمد على المسافات من المركز. .
Radial Basis Function Network (RBFN),شبكة دالة القاعدة الشعاعية,شبكة عصبية اصطناعية تستخدم دالة الأساس النصف قطرية كدالة تنشيط لمهام التصنيف غير الخطية.       () .
Rand Index,مؤشر راند,مقياس لتقييم التشابه بين طريقتين للتجميع. .
Random Forest,غابة عشوائية,طريقة تعُّلم تجميعي ُتنشئ عدًدا من أشجار القرارات، ثم تجمع مخرجاتها للحصول على أفضل نتيجة. .
Random Policy,سياسة عشوائية,سياسة في التعُّلم التعزيزي تختار الفعل عشوائًّيا. .
Rank,رتبة,الموضع الترتيبي لصنف في نموذج تعُّلم الآلة الذي يرتب الأصناف من الأعلى إلى الأدنى. .
Ranking Loss,خسارة ترتيبية,دالة خسارة تركز على التنبؤ بالترتيب النسبي للعناصر. .
Rater,ُمقِّيم,انظر ُمَوِّصف. .
Re-Programmable Robot,روبوت قابل إلعادة البرمجة,روبوت مصَّمم بطريقة ُتمّكن من تعديل حركاته المبرمجة أو وظائفه المساندة، دون الحاجة الى أي تغيير مادي. .
Re-Ranking,إعادة ترتيب,خطوة أخيرة في نظام التوصيات تأخذ في الاعتبار المعايير أو القيود الإضافية إلعادة ترتيب العناصر المسجلة. .
Real-Time Data,بيانات آنية,البيانات التي يمكن الوصول إليها فور توليدها. .
Reasoning and Acting )ReAct( Prompting,أوامر الاستدلال والتصرف,أسلوب في هندسة الأوامر يجمع بين الاستدلال والتصرف لتمكين النماذج من حل مهام متنوعة في الاستدلال واتخاذ القرار. .
Reasoning and Decision-Making,استدلال واتخاذ القرار,جزء من طريقة تمثيل المعرفة والاستدلال يركز على تصميم خوارزميات الاستنتاج وتحليلها وتنفيذها. .
Recall,استدعاء,مقياس لتحديد نسبة القيم الإيجابية الفعلية التي ُحددت تحديًدا صحيًحا. وُيطلق عليه أيًضا معدل إيجابي صحيح.   . .()
Recall-Oriented Understudy for Gisting,مقياس روج,() مجموعة من المقاييس المستخدمة لتقييم جودة التلخيص التلقائي وترجمة الآلة، عن طريق قياس التداخل بين المخرجات التي ينشئها النظام والمراجع التي ينشئها الإنسان. .
Receiver Operating Characteristic )ROC( Curve,منحنى دّقة الأداء,تمثيل رسومي ألداء الُمصِّنف في جميع الحدود الممكنة. .
Recommendation Engine,ُم َحِّرك توصيات,انظر نظام توصيات. .
Recommendation System )or Recommender System(,نظام توصيات,نظام يوصي المستخدمين بمجموعة من العناصر بناًء على اختياراتهم وسلوكياتهم. ُيطلق عليه أيًضا ُمَحِّرك توصيات.   . .
Rectified Linear Unit )ReLU( ),وحدة خطية مصححة (ريلو,دالة تنشيط ُتعطي القيمة صفًرا إذا كان الُمْد َخل سالًبا أو صفًرا، وتعطي القيمة نفسها إذا كان الُمْدَخل موجًبا. .
Recurrent Neural Network (RNN),شبكة عصبية تكرارية,نوع من الشبكات العصبية ُيستخدم لفهم المعلومات المتسلسلة، وتحديد الأنماط عن طريق التشغيل عدة مرات. .
Reference Data,بيانات مرجعية,البيانات المستخدمة لتصنيف البيانات الأخرى. .
Reflexion,انعكاس,إطار ُمصَّمم لتحسين تعُّلم وأداء النماذج اللغوية، عن طريق التغذية الراجعة. .
Regression,انحدار,انظر تحليل الانحدار. .
Regression Analysis,تحليل الانحدار,أسلوب إحصائي لتحديد العلاقة بين المتغيرات التابعة والمستقلة. ُيطلق عليه أيًضا انحدار أو نموذج انحدار. . .
Regression Model,نموذج انحدار,انظر تحليل الانحدار. .
Regularization,ضبط,عملية ُتستخدم لمنع فرط التخصيص عن طريق إضافة معلومات إضافية. .
Regularization Rate,معدل الضبط,قيمة تحدد الأهمية النسبية لدالة الضبط. وُيطلق عليها أيًضا المدا. .   .
Reinforcement Learning )RL(,تعُّلم تعزيزي,نوع من تعُّلم الآلة يتعَّلم السياسة المثلى عن طريق المكافآت والعقوبات؛ ألجل تحسين إجمالي المكافأة. .
Reinforcement Learning From Human Feedback,تعُّلم تعزيزي بالتغذية الراجعة البشرية,)( أسلوب لتحسين جودة مخرجات النماذج عن طريق دمج التغذية الراجعة من التفاعالت أو التقييمات البشرية. .
Relational Database,قاعدة بيانات علائقية,نوع من قواعد البيانات ُين ِّظم البيانات في جداول تحتوي على صفوف وأعمدة. .
Relational Machine Learning )RML(,تعُّلم الآلة العلائقي,نوع من تعُّلم الآلة يركز على التعُّلم من البيانات ذات العلاقات والهياكل المعقدة. .
Relational Model,نموذج عالئقي,نموذج بيانات ينظم البيانات في جداول تحتوي على صفوف وأعمدة. .
Relationship Extraction,استخراج العلاقة,عملية تحديد العلاقات بين الكيانات المذكورة في النص. .
Relative Entropy,انتروبيا نسبية,انظر تباعد كولباكليبلر. . ()
Reliability,اعتمادية,خاصية الاتساق المقصود في السلوك والنتائج. .
Remote Biometric Identification )RBI( System,نظام تحديد القياسات الحيوية عن ُبعد,تقنية تستخدم الذكاء الاصطناعي للتعُّرف على الأفراد عن ُبعد، عن طريق مقارنة بيانات قياساتهم الحيوية (مثل: مالمح ) الوجه أو بصمات الأصابع) بقاعدة بيانات مرجعية.    ( .
Replay Buffer,ذاكرة إعادة التشغيل,ذاكرة يستخدمها الوكيل لتخزين التحوالت، ويمكن استخدامها إلعادة تشغيل التجربة. .
Reporting Bias,تحُّيز الإبالغ,نوع من التحُّيز يحدث عندما لا يعكس التكرار الموجود في مجموعة البيانات التكرار الموجود في العالم الحقيقي. .
Reservoir Computing )RC(,حوسبة المكامن,إطار حوسبي ُيب ِّسط تدريب الشبكات العصبية التكرارية لمعالجة البيانات المتسلسلة والزمنية. .
Residual Sum of Squares )RSS(,مجموع المربعات المتبقية,أسلوب إحصائي لقياس التباين بين البيانات والقيم التي تنبأ بها نموذج التقدير. وُيطلق عليه أيًضا مجموع المتبقيات المربعة.      . .()
Resilience,صمود,قدرة النظام على استعادة العمليات بسرعة بعد وقوع حادث. .
Resource Description Framework (RDF),إطار وصف الموارد,نموذج قياسي لتبادل البيانات على الويب. .
Responsible Artificial Intelligence,ذكاء اصطناعي مسؤول,تصميم أنظمة الذكاء الاصطناعي وتطويرها ونشرها بطرق تتوافق مع المبادئ الأخالقية والقيم المجتمعية والمعايير القانونية. .
Restricted Boltzmann Machine (RBM),آلة بولتزمان المقيدة,شبكة عصبية اصطناعية عشوائية تتعَّلم توزيع الاحتمالات على الُمْدَخلات، عن طريق تطبيق نماذج شبكية. .
Rete Algorithm,خوارزمية ريتي,خوارزمية مطابقة أنماط ُتستخدم في ُمَحِّركات القواعد لمقارنة الأنماط بالأشياء. .
Retraining,إعادة تدريب,عملية تحديث النموذج المدَّرب، عن طريق تدريبه ببيانات جديدة. .
Retrieval-Augmented Generation (RAG),توليد ُمَعَّزز بالاسترجاع,إطار للذكاء الاصطناعي يدمج بين استرجاع المعلومات الخارجية والنماذج التوليدية لإنتاج استجابات أكثر دقة وملاءمة للسياق.
Return,عائد,إجمالي المكافآت في التعُّلم التعزيزي الذي يتوقعه الوكيل عند اتباع سياسة معينة. .
Reward,مكافأة,نتيجة عددية في التعُّلم التعزيزي تحدده البيئة عند القيام بفعل في حالة ما. .
Reward Function,دالة المكافأة,آلية تحفيز في التعُّلم التعزيزي ُتحدد الكيفية التي يلزم الوكيل اتباعها للقيام بأفعال في بيئة ما. .
Reward Model,نموذج المكافأة,نموذج متخصص يقدم التوجيه لتحقيق النتائج المرجوة، عن طريق التغذية الراجعة في شكل مكافآت. .
Ridge Regularization,ضبط ريدج,انظر ضبط إل . .
Robot,روبوت,جهاز قابل للبرمجة قادر على أداء المهام المطلوبة تلقائًّيا عن طريق استشعار بيئته. .
Robot Control System,نظام التحكم بالروبوت,مجموعة من التحكم المنطقي ووظائف الطاقة التي تتحكم في الهيكل الميكانيكي للروبوت وتواصله مع البيئة المحيطة. .
Robot Journalism,صحافة روبوتية,استخدام البرمجيات لكتابة المحتوى دون تدخل بشري. ُيطلق عليها أيًضا صحافة مؤتمتة.     . .
Robot System,نظام روبوت,نظام يتضمن روبوًتا واحًدا أو أكثر وأجهزة أخرى تدعمه ألداء     () مهامه. .
Robotic Desktop Automation )RDA(,أتمتة روبوتية لسطح المكتب,برمجيات ألتمتة المهام الروتينية المتكررة على سطح مكتب المستخدم، وغالًبا ما تحاكي الإجراءات البشرية لتحسين الكفاءة وتقليل الأخطاء. .
Robotic Device,جهاز روبوتي,آلية مشغلة تحقق خصائص الروبوت الصناعي أو الخدمي، ولكنها تفتقد المحاور القابلة للبرمجة أو درجة التحكم الذاتي.
Robotic Process Automation (RPA),أتمتة العمليات الروبوتية,نوع من أتمتة العمليات تحاكي فيه البرمجيات أو الروبوتات كيفية إنجاز البشر لمهمة ما. .
Robotics,علم الروبوتات,مجال يركز على تصميم الروبوتات وتطويرها وتطبيقها. .
Robustness,متانة,قدرة النظام على الحفاظ على أدائه تحت أي ظرف. .
Role Prompting,أوامر تعيين الدور,أسلوب لهندسة الأوامر ُيو َّجه فيه النموذج لتبني دور أو شخصية محددة من أجل تشكيل مخرجاته وأسلوبه. .
Root Mean Square Deviation )RMSD(,جذر متوسط الانحراف التربيعي,انظر جذر متوسط الخطأ التربيعي. .()
Root Mean Squared Error )RMSE(,جذر متوسط الخطأ التربيعي,مقياس الفرق بين القيم المتوقعة والقيم الفعلية. وُيطلق عليه أيًضا جذر متوسط الانحراف التربيعي.     . .()
Rotational Invariance,انعدام تأثير الدوران,قدرة الخوارزمية على تصنيف الصور تصنيًفا صحيًحا، بغِّض النظر عن التغّير في اتجاهها. .
Rule-Based Chatbot,بوت محادثة قائم على قواعد,انظر بوت محادثة موَّجه. .
Rule-Based System,نظام قائم على قواعد,نظام خبير يتضمن قواعد شرطية ُبنيت بالتعُّلم من بيانات حقيقية أو باستخدام معرفة الخبراء. .
Safety,سالمة,الخلو من المخاطر غير المقبولة. .
Sample,عينة,عنصر بيانات يمكن لخوارزمية تعُّلم الآلة معالجته. .
Sample Size,حجم العينة,عدد المشاهدات الفردية التي ُتمِّثل المجموعة في التجربة. .
Sampling Bias,تحُّيز أخذ العِّينات,نوع من تحُّيز الاختيار لا ُتجمع فيه البيانات عشوائًّيا. .
Scalability,قابلية التوسع,قدرة النظام على التعامل مع كمية العمل المتزايدة. .
Scale Invariance,انعدام تأثير الحجم,قدرة النموذج على الحفاظ على سلوك متسق بغض النظر عن حجم الُمْدَخلات. .
Scatter-Gather,توزيع-تجميع,نوع من معالجة البيانات الكبيرة ُيوِّزع الحوسبة المطلوبة عبر ُعَقد مختلفة، ثم ُيجِّمع النتائج الإجمالية من كل عقدة. .
Scikit-Learn,سايكيت-ليرن,مكتبة شهيرة مفتوحة المصدر ُتستخدم في تعُّلم الآلة، مكتوبة بلغة بايثون. .
Scoring,تقييم,جزء من نظام التوصية ُيعّين ترتيًبا لكل عنصر ُأنشئ بواسطة عملية توليد الترشيحات. .
Search Query,استعلام بحثي,كلمة أو مجموعة من الكلمات التي يدخلها المستخدم في ُمَحِّرك البحث للعثور على محتوى. .
Security,أمن,الدرجة التي يحمي بها النظام البيانات والمعلومات، عن طريق السماح بالوصول المناسب إلى البيانات بناًء على مستويات التفويض. .
Selection Bias,تحُّيز الاختيار,تحُّيز في اختيار البيانات المستخدمة في تدريب نماذج تعُّلم الآلة. .
Selective Filtering,تصفية انتقائية,عملية تجاهل البيانات المشِّوشة من أجل التركيز على البيانات المهمة. .
Self-Attention )or Self-Attention Layer( ),انتباه ذاتي (أو طبقة الانتباه الذاتي,طبقة في الشبكة العصبيةُ تخرج تسلس ًال جديًدا من التضمينات، عن طريق تطبيق آلية الانتباه على المعلومات الواردة من عناصر تسلسل الُمْدَخلات. .
Self-Aware Artificial Intelligence,ذكاء اصطناعي واع بذاته,ٍ تصور نظري لذكاء اصطناعي لديه إدراك ووعي بوجوده، وقادر على فهم أفكاره وعواطفه وبيئته.
Self-Consistency Prompting,أوامر الاتساق الذاتي,أسلوب في هندسة الأوامر ُيح ِّسن دقة النماذج، عن طريق إنشاء استجابات متعددة لنفس الأمر، واختيار الإجابة الأكثر تكراًرا أو اتساًقا لتكون الإجابة النهائية.
Self-Criticism Prompting,أوامر النقد الذاتي,انظر أوامر التحسين الذاتي. .
Self-Driving Car,سيارة ذاتية القيادة,سيارة قادرة على استشعار محيطها والتحرك بتحكم واكتفاء ذاتي. وُيطلق عليها أيًضا سيارة بدون سائق أو سيارة  . ذاتية التحكم. .
Self-Instruct,إرشاد ذاتي,طريقة لتحسين قدرة النماذج على اتباع تعليمات اللغات الطبيعية، عن طريق توليد بيانات اتباع التعليمات بنفسها. .
Self-Labeling,تسمية ذاتية,نوع من ُطُرق التعُّلم الشبه الموَّجه ُيدِّرب نموذًجا على بيانات ُمسَّماة، ثم يستخدمه إلعطاء أسماء مستعارة للبيانات غير الُمسَّماة. .
Self-Refine Prompting,أوامر التحسين الذاتي,أسلوب في هندسة الأوامر ُيتيح للنموذج تحسين مخرجاته، عن طريق عملية تكرارية من التغذية الراجعة والتحسين. ُيطلق عليه أيًضا أوامر النقد الذاتي.   . .
Self-Supervised Learning,تعُّلم ذاتي التوجيه,نوع من تعُّلم الآلة يستخدم بيانات غير ُمسَّماة لتعُّلم الخصائص؛ وذلك بالاعتماد على أسماء مستعارة محددة بصورة ذاتية في عملية التوجيه. .
Self-Training,تدريب ذاتي,طريقة تعُّلم ذاتي التوجيه ُتستخدم في التصنيف عندما تكون البيانات غير الُمسَّماة أكثر من البيانات الُمسَّماة. .
Semantic Chunking,تقطيع دلالي,عملية تقسيم نص كبير إلى وحدات أصغر ذات معنى بناًء على معناها أو سياقها الأساسي. .
Semantic Computing,حوسبة دلالية,مجال حوسبي يركز على فهم البيانات وتمثيلها ومعالجتها بناًء على معناها وسياقها. .
Semantic Mapping,هيكلة دلالية,عملية إنشاء علاقات وروابط ذات معنى بين عناصر البيانات من مصادر مختلفة. .
Semantic Network,شبكة دلالية,انظر شبكة معرفية. .
Semantic Reasoner,ُمستِدل دلالي,برمجيات ُتستخدم الستخالص النتائج المنطقية من مجموعة من الحقائق والبديهيات المؤكدة. .
Semantic Search,بحث دلالي,أسلوب بحث يفهم المعنى السياقي الستعالم المستخدم لتقديم نتائج أكثر صلة ودقة. .
Semantic Web,ويب دلالي,امتداد لشبكة الويب العالمية لتمكين مشاركة البيانات وإعادة  (ً) استخدامها عبر التطبيقات، عن طريق تحديد مخازن البيانات والمفردات وقواعد التعامل مع البيانات. .
Semi-Structured Data,بيانات شبه مهيكلة,البيانات التي لا تخضع لهيكل ثابت، ولكن لها بعض الخصائص التنظيمية. وُيطلق عليها أيًضا بيانات مهيكلة جزئًّيا.  . .
Semi-Supervised Anomaly Detection,اكتشاف الشذوذ شبه المو َّجه,أسلوب ُيستخدم لتحديد الأنماط غير المعتادة داخل مجموعة البيانات باستخدام البيانات الُمسَّماة وغير الُمسَّماة. .
Semi-Supervised Learning,تعُّلم شبه مو َّجه,نوع من تعُّلم الآلة يستفيد من البيانات الُمسَّماة وغير الُمسَّماة للتدريب. .
Sensitive Attribute,سمة حساسة,سمة بشرية لها اعتبار خاص لبعض الأسباب. .
Sensitive Data,بيانات حساسة,بيانات قد يسبب إفشاؤها أو سوء استخدامها آثاًرا ضارة. .
Sensitivity,دقة الحساسية,معدل صحة تنبؤ النموذج للأسماء الإيجابية عندما تكون بالفعل كذلك. .
