English Term,Arabic Term,Arabic Description
Frame,إطار,هيكل بيانات ُيمِّثل الحالات النمطية لتقسيم المعرفة إلى ُبنى فرعية. .
Frame Language,لغة الإطار,لغة تستخدم الإطارات لتمثيل المعرفة. .
Frame Problem,مشكلة الإطار,مشكلة تحديد ما يبقى دون تغيير نتيجة الأفعال أو الأحداث. .
Fréchet Inception Distance )FID(,مسافة بداية فريشيه,مقياس ُيستخدم لتقييم جودة الصور الموَّلدة عن طريق النماذج التوليدية. .
Friendly Artificial Intelligence )FAI(,ذكاء اصطناعي وِّدي,ذكاء عام اصطناعي افتراضي يدعم القيم الإنسانية، وله أثر () إيجابي في البشرية. .
Frozen Model,نموذج ُمجَّمد,نموذج ُتثَّبت ُمعاِمالته لمنع المزيد من التدريب أو التعديل، غالًبا لتسهيل عملية النشر أو الاستنتاج. .
Fully Connected Layer,طبقة متصلة كلًّيا,طبقة مخفية في شبكة عصبية اصطناعية تتصل كل عقدة فيها بكل عقدة في الطبقة المخفية التالية. وُيطلق عليها أيًضا طبقة كثيفة. .    .
Fuzzy Logic,منطق ضبابي,نوع من أنواع الُّن ُظم المنطقية ُيتيح التعبير بطريقة موسعة عن البيانات المنطقية، عن طريق توفير تمييز متعدد القيم بين الصواب والخطأ. .
Fuzzy Rule,قاعدة ضبابية,قاعدة في المنطق الضبابي مكتوبة على شكل جملة شرطية. .
Game Theory,نظرية اللعبة,فرع من فروع النمذجة الرياضية يهتم بدراسة الصراع والتعاون بين صناع القرار العقالنيين. .
Gated Recurrent Unit )GRU(,وحدة بوابة تكرارية,نوع من الشبكات العصبية التكرارية المصممة لمعالجة البيانات المتسلسلة باستخدام آليات البوابات للتحكم في تدفق المعلومات. .
Gaussian Distribution,توزيع جاوسي,انظر توزيع طبيعي. .
Gaussian Error Linear Unit )GeLU( ),وحدة الخطأ الخطي الجاوسي (جيلو,دالة تنشيط تطبق تحوي ًال سل ًسا غير خطي على الُمْدَخلات، عن طريق الاحتمال التراكمي للتوزيع الطبيعي. .
General Artificial Intelligence,ذكاء اصطناعي عام,انظر ذكاء عام اصطناعي. .()
Generalization,تعميم,قدرة النموذج على تقديم تنبؤات صحيحة بناًء على بيانات جديدة. .
Generalization Curve,منحنى التعميم,منحنى خسارة يوضح مجموعة التدريب، ومجموعة التحقق؛ للمساعدة في اكتشاف فرط التخصيص. .
Generalized Additive Model (GAM),نموذج إضافي ُمعَّمم,نموذج إحصائي ُيتيح علاقات مرنة وغير خطية بين المتغير التابع والمتغيرات المستقلة عن طريق الجمع بين النماذج الخطية والدوال السلسة. .
Generalized Linear Model (GLM),نموذج خطي ُمعَّمم,توسيع لالنحدار الخطي ُيتيح لدوال توزيع المخرجات المختلفة تحديد التباين بين المشاهدات والقيم التنبؤية.
Generated Knowledge Prompting,أوامر المعرفة الموَّلدة,أسلوب في هندسة الأوامر ُيوِّلد معرفة مفيدة إضافية للنموذج لتحسين فهمه واستجابته للأوامر. .
Generative Adversarial Network (GAN),شبكة توليدية تنافسية,خوارزمية تعُّلم آلة غير موَّجه مكَّونة من شبكتين عصبيتين: شبكة مولدة وشبكة تمييزية، تتنافسان في إطار لعبة صفرية الناتج. .
Generative Artificial Intelligence )GenAI(,ذكاء اصطناعي توليدي,نوع من الذكاء الاصطناعي يمكنه إنشاء محتوى جديد، مثل: النصوص والصور والأصوات والفيديوهات والأكواد البرمجية. .
Generative Feedback Loop,حلقة تغذية راجعة توليدية,عملية دورة ُتغَّذى فيها المخرجات الناتجة عن النموذج مرة أخرى إلى النظام على شكل بيانات تدريب؛ وهو ما يتيح التعُّلم والتحسين المستمر. .
Generative Image Model,نموذج توليدي للصور,نموذج تعُّلم آلة قادر على إنتاج صور جديدة بناًء على أوصاف نصية أو ُمدخلات أخرى. .
Generative Model,نموذج توليدي,نموذج تعُّلم آلة يمكنه إنشاء أمثلة جديدة مشابهة لبيانات التدريب. .
Generative Pre-Trained Transformer )GPT( ),ُمحِّول توليدي ُمدَّرب سابًقا (جي بي تي,عائلة من النماذج اللغوية الكبيرة تعتمد على ُمحِّول. .
Generative Product Design,تصميم توليدي للمنتجات,البرمجيات التي ُتوِّلد مسودات بجميع الخصائص والمتطلبات المحددة لإنشاء تصميمات للمنتجات. .
Generator,ُموِّلد,جزء من شبكة توليدية تنافسية ُينشئ بيانات مزيفة. .
Genetic Algorithm,خوارزمية جينية,نوع من الخوارزميات التطورية الذي يستخدم مبادئ الانتقاء الطبيعي لإيجاد حلول مناسبة لمشكالت التحسين. .
Geometric Deep Learning,تعُّلم عميق هندسي,مجال فرعي من التعُّلم العميق يركز على تصميم الشبكات العصبية التي يمكنها معالجة البيانات ذات الهياكل الهندسية، مثل الرسوم البيانية والشبكات. .
Geometric Distribution,توزيع هندسي,توزيع احتمالي يوضح عدد التجارب الالزمة لتحقيق أول نجاح في تجربة برنولي. .
Glowworm Swarm Optimization (GSO),تحسين سرب الدودة المضيئة,خوارزمية ذكاء سرب تحاكي سلوك الحشرات المضيئة للحصول على الحد الأقصى من دالة الصيغ المتعددة. .
Gradient,تدُّرج,ُمَّتجه للمشتقات الجزئية في دالة النموذج، يقيس التغير في الأوزان بالنظر إلى التغير في الخطأ. .
Gradient Ascent,صعود تدرجي,خوارزمية تحسين للعثور على الحد الأقصى للدالة، عن طريق ضبط الُمعاِملات بشكل متكرر في اتجاه التدرج. .
Gradient Boosting,تعزيز تدرجي,أسلوب في تعُّلم الآلة ُيستخدم في التصنيف والانحدار لإنشاء نموذج تنبؤ قوي من نماذج تنبؤ ضعيفة. .
Gradient Clipping,قص تدرجي,آلية لتقليل مشكلة انفجار التدرج عن طريق تقييد القيمة القصوى للتدرجات عند تدريب نموذج باستخدام النزول التدرجي.
Gradient Descent,نزول تدرجي,خوارزمية تحسين للعثور على الحد الأدنى من الدالة، عن طريق اتخاذ خطوات بصورة تكرارية تتناسب مع سالب التدرج. .
Graph Data Science,علم البيانات الشبكي,مجال يستخدم هياكل البيانات الشبكية لفهم العلاقات واستخراج الرؤى من البيانات المترابطة. .
Graph Database )GDB(,قاعدة بيانات شبكية,قاعدة بيانات تستخدم الُعَقد والحافات لتمثيل البيانات وعلاقاتها. .
Graph Neural Network )GNN(,شبكة عصبية شبكية,نوع من ُطُرق التعُّلم العميق يعالج البيانات الممَّثلة على شكل شبكات. .
Graph Prompting,أوامر شبكية,أسلوب في هندسة الأوامر يستخدم تمثيالت البيانات القائمة على الشبكة من أجل تحسين فهم النموذج واستجابته. .
Graph Retrieval-Augmented Generation,توليد ُمَعَّزز بالاسترجاع الشبكي,() أسلوب يجمع بين تمثيل المعرفة القائم على الشبكة والتوليد الُمَعَّزز بالاسترجاع لتحسين دقة النصوص المولدة وملاءمتها.
Graph Traversal,مسح الشبكة,عملية المرور على جميع الُعَقد في الشبكة. .
Graphical Model,نموذج شبكي,فئة من النماذج الإحصائية التي تستخدم الرسوم الشبكية لتمثيل العلاقات الاحتمالية بين المتغيرات. .
Graphics Processing Unit (GPU),وحدة معالجة الرسوميات,دائرة إلكترونية تقوم بحوسبة متوازية لتسريع إنشاء الصور لعرضها على جهاز إلكتروني. .
Greedy Algorithm,خوارزمية جشعة,خوارزمية تختار أفضل حل فوري لمشكلة ما أثناء إيجاد الحل الأمثل الشامل. .
Grid Computing,حوسبة شبكية,مجموعة من أجهزة الحاسب المتصلة بالشبكة، وتعمل كأنها جهاز حاسب عمالق افتراضي لتنفيذ المهام الكبيرة. .
Ground Truth,حقيقة أساسية,المعلومات المكتسبة من المالحظة المباشرة بد ًال من الاستنتاج. .
Group Attribution Bias,تحُّيز الانتساب للمجموعة,افتراض أ َّن ما ينطبق على فرد واحد ينطبق على كل أفراد المجموعة. .
Hadoop,هدوب,إطار مفتوح المصدر يوفر معالجة موَّزعة لمجموعات كبيرة من البيانات عبر مجموعات من أجهزة الحاسب. .
Hadoop Distributed File System )HDFS(,نظام هدوب للملفات الموَّزعة,ُمَحِّرك تخزين مفتوح المصدر، يعتمد على معمارية نظام ملفات جوجل، ومصَّمم للتخزين الفاعل للملفات الكبيرة.   () .
Hard Prompting,أوامر صلبة,تعليمات نصية ُمصاغة یدوًّیا ُتعطى للنموذج من أجل الحصول على نوع معين من الاستجابة. .
Hashing Trick,حيلة التهشير,انظر تهشير الخصائص. .
Heteronomy )or Heteronomous( ),تحكم غير ذاتي (أو غير ذاتي,خاصية نظام يعمل تحت قيود تحكم خارجي. .
Heuristic,أسلوب إرشادي,أسلوب لتقديم حل سريع لمشكلة ما قد لا يكون هو الحل الأمثل، ولكنه تقريبي. .
Heuristic Search,بحث إرشادي,أسلوب لإيجاد حل جيد، ليس بالضرورة الحل الأمثل، في غضون فترة زمنية معقولة. .
Hidden Layer,طبقة مخفية,طبقة مصطنعة تقع بين طبقتي الُمْدَخلات والمخرجات في الشبكة العصبية. .
Hierarchical Clustering,تجميع هرمي,نوع من خوارزميات التجميع المناسبة للبيانات الهرمية لتوليد شجرة من المجموعات. .
Hinge Loss,خسارة مفصلية,دالة خسارة للتصنيف الذي يهدف إلى تعظيم الهامش بين أمثلة التدريب والحد، وذلك عن طريق وضع حد القرار أبعد ما يمكن عن كل مثال. .
Holdout Data,بيانات مستثناة,مجموعة البيانات التي لم ُتستخدم عن قصد أثناء التدريب، وسُتستخدم لتقييم قدرة النموذج على التعميم. .
Horizontal Scaling,توسيع أفقي,طريقة لزيادة الأداء وسعة التخزين والتوُّفر عن طريق تقسيم مجموعات البيانات، ونسخها إلى مجموعات من الخوادم. .
Hot Data Storage,تخزين البيانات النشطة,بيانات مخَّزنة يمكن الوصول إليها بسرعة لالستخدام الفوري. .
Human Action Recognition,تعُّرف على الأفعال البشرية,انظر تعُّرف على الأفعال. .
Human Activity Recognition )HAR(,تعُّرف على النشاط البشري,انظر تعُّرف على الأفعال. .
Human Augmentation,تعزيز البشر,مجال يركز على تعزيز قدرات الإنسان باستخدام التقنية كأنها جزء متكامل مع جسم الإنسان. .
Human Takeover,تد ّخل بشري,ميزة احتياطية في بوت محادثة تسمح بتولي موظف مركز الاتصال المحادثة بدًال من بوت المحادثة. .
Human-Computer Interaction )HCI(,تفاعل بين الإنسان والحاسب,دراسة تصميم وتنفيذ التفاعل بين المستخدمين وأجهزة الحاسب. .
Human-in-the-Loop )HITL(,إنسان في الحلقة,طريقة تدمج الُمْدَخلات البشرية في دورة حياة أنظمة الذكاء الاصطناعي لتقديم المالحظات وتحسين النتائج. .
Human-Machine Teaming,تكامل بين الإنسان والآلة,تكامل التفاعل البشري وقدرات ذكاء الآلة. .
Human-Robot Interaction )HRI(,تفاعل بين الإنسان والروبوت,مجال يركز على تبادل المعلومات والأفعال بين الإنسان والروبوت ألداء المهام عن طريق واجهة المستخدم. .
Humanoid Robot,روبوت بشري,روبوتات مصممة لتشبه وتحاكي بنية جسم الإنسان وسلوكه. .
Hyper-Heuristic,إرشاد فائق,منهجية بحث عالية المستوى تعمل على أتمتة عملية اختيار الأساليب الإرشادية، أو دمجها لحل مشكالت البحث المعقدة. .
Hyperbolic Tangent )Tanh( Function,دالة الظل الزائدي,دالة تنشيط ُتعِّين الِقَيم الُمْدَخلة إلى نطاق يتراوح بين  و. .
Hyperparameter,ُمعاِمل ضبط,ُمعاِمل ُيضَبط قبل بدء عملية التعُّلم للتحكم في سلوك خوارزمية التعُّلم. .
Hyperparameters Tuning,ضبط ُمعاِمالت الضبط,عملية اختيار ُمعاِمالت الضبط المثلى لتدريب نموذج ما على مجموعة بيانات معينة. .
Hyperplane,مستوي متعدد الأبعاد,حد فاصل بين مساحتين فرعيتين ُيستخدم لفصل مساحة البيانات من أجل التصنيف. .
Hypothesis,فرضية,فكرة أو تنبؤ بحاجة إلى بحث واختبار عن طريق التجربة. .
Hypothetical Document Embeddings )HyDE(,تضمين المستندات الافتراضي,أسلوب استرجاع ُينشئ تضمينات افتراضية للمستندات، ثم يستخدمها السترداد مستندات مماثلة من نفس مساحة التضمين. .
Image Classification,تصنيف الصور,انظر َتعُّرف على الصور. .
Image Processing,معالجة الصور,استخدام خوارزمية لمعالجة الصور أو استخراج معلومات مفيدة منها. وُيطلق عليه أيًضا معالجة الصور الرقمية.    . .
Image Recognition,َتعُّرف على الصور,عملية تحديد الأشياء أو الأنماط أو المفاهيم الموجودة في الصورة. وُيطلق عليها أيًضا تصنيف الصور أو تعُّرف مرئي.     . .
Image Segmentation,تقسيم الصور,عملية تقسيم الصورة الرقمية إلى مجموعات من البكسالت. .
ImageNet,إيمج نت,قاعدة بيانات كبيرة للصور تتكون من أكثر من  مليون صورة مَوَّصفة ومصَّنفة في  ألف فئة، معدة ألبحاث رؤية الحاسب. .
Imbalanced Dataset,بيانات غير متوازنة,انظر بيانات غير متوازنة الأصناف. .
Implicit Bias,تحُّيز ضمني,نوع من التحُّيز يكون فيه الارتباط أو الافتراض وفًقا لعقل الشخص وذكرياته. .
Imputation,استبدال تقديري,عملية وضع بيانات منمذجة أو مقدرة بدًال من بيانات مفقودة. .
In-Context Learning,تعُّلم سياقي,أسلوب في هندسة الأوامر يتعلم فيه النموذج أداء المهام، عن طريق تزويده ببعض الأمثلة في سياق ُمدخلات الأمر. ُيطلق عليه أيًضا تعُّلم قائم على الأوامر. .    .
In-Database Analytics,تحليالت في قاعدة البيانات,معالجة البيانات وتحليلها مباشرة داخل قاعدة البيانات التي ُتخَّزن فيها البيانات. .
In-Group Bias,تحُّيز داخل المجموعة,نوع من التحُّيز يكون فيه التفضيل لمجموعة الشخص أو خصائصه. .
In-Memory Database )IMDB(,قاعدة بيانات في الذاكرة,قاعدة بيانات تخزن البيانات في الذاكرة الرئيسة بدًال من ُمَحِّرك الأقراص لتسريع أوقات الاستجابة. .
In-Processing Algorithm,خوارزمية أثناء المعالجة,خوارزمية ُتستخدم لتعديل النموذج أثناء تدريبه. .
Incompatibility of Fairness Metrics,عدم توافق مقاييس الإنصاف,تصُّور يقوم على أن بعض مفاهيم الإنصاف لا يمكن تحقيقها في وقت واحد؛ وِمن َثّم لا يوجد مقياس واحد لتحديد الإنصاف في جميع مشكالت تعُّلم الآلة. .
Incremental Learning,تعُّلم تدريجي,طريقة من ُطُرق تعُّلم الآلة يكون التدريب والتعُّلم فيها مستمًّرا كلما ظهرت أمثلة جديدة. .
Independent and Identically Distributed )IID(,متغيرات مستقلة ومتطابقة التوزيع,متغيرات عشوائية مستقلة عن بعضها البعض، ولها نفس التوزيع الاحتمالي. .
Individual Fairness,إنصاف فردي,مقياس إنصاف لفحص ما إذا كان الأفراد المتشابهون قد ُصِّنفوا بنفس الطريقة. .
Induction,استقراء,انظر استدلال استقرائي. .
Inductive Programming,برمجة استقرائية,مجال يهتم بتصميم خوارزميات لبرامج حاسب ذات تحكم معقد من مواصفات غير كاملة. .
Inductive Reasoning,استدلال استقرائي,عملية استخلاص استنتاجات عامة من مالحظات أو أمثلة محددة. وُيطلق عليها أيًضا استقراء.   . .
Industrial Robot,روبوت صناعي,روبوت مؤتمت وقابل للبرمجة ُيستخدم في التطبيقات الصناعية. .
Industrial Robot Cell,خلية روبوتات صناعية,نظام أو أنظمة روبوت صناعية تشمل آلات ومساحات محمية.  ()  () .
Industrial Robot Line,مسار روبوت صناعي,مجموعة من خلايا الروبوتات الصناعية التي تؤدي بعض الوظائف مع المعدات المرتبطة بها في أماكن محمية. .
Inertia,قصور ذاتي,مقياس لمدى نجاح خوارزمية التجميع في تجميع نقاط البيانات. .
Inference,استنتاج,عملية استخدام نموذج ُمدَّرب للتنبؤ أو اتخاذ القرارات بناًء على بيانات جديدة. .
Inference Engine,ُم َحِّرك استنتاج,ُمكِّون من ُمكِّونات الُّن ُظم الخبيرة يقوم بعملية الاستدلال الستنتاج معلومات جديدة من الحقائق والقواعد المخزنة في قاعدة المعرفة. .
Information,معلومات,بيانات معالجة لها معنى في سياق معين. .
Information Extraction,استخراج المعلومات,عملية الحصول على المعرفة، عن طريق استعراض النصوص بحًثا عن أصناف محَّددة للأشياء وعلاقاتها. .
Information Retrieval,استرجاع المعلومات,عملية الحصول على المعلومات ذات الصلة باحتياجات المستخدم من مجموعة كبيرة من البيانات. .
Information Theory,نظرية المعلومات,دراسة العمليات التي ُتجرى على المعلومات الرقمية، مثل: النقل والتخزين والضغط. .
Input Data )or Input( ),بيانات ُمْد َخلة (أو ُمدخلات,أي شكل من أشكال البيانات الُمْد َخلة إلى نظام معالجة معلومات أو أي من ُمكِّوناته لغرض المعالجة أو التخزين. .
Input Layer,طبقة ُمدخلات,الطبقة الأولى في الشبكة العصبية التي تتلقى البيانات الُمْدَخلة. .
Instance,حالة,انظر مثال. .
Instance Segmentation,تقسيم الأشياء,مهمة في رؤية الحاسب تتضمن تحديد وتوضيح كل شيء ُممَّيز داخل الصورة، وُتعِّين حدوًدا دقيقة واسًما فريًدا لكل الأشياء فيها. .
Instruction Data,بيانات التعليمات,البيانات التي تحتوي على: أمثلة للمهام، والاستجابات المطلوبة، وأحياًنا سياق إضافي؛ لتحسين نموذج ُمدَّرب. .
Instruction Tuning,ضبط التعليمات,شكل من أشكال الضبط الدقيق ُيدَّرب فيه النموذج بناًء على سلسلة من التعليمات لتحسين أدائه في مهام محددة. .
Intelligence Amplification )IA(,تضخيم الذكاء,استخدام التقنية لزيادة الذكاء البشري. .
Intelligence Augmentation,تعزيز الذكاء,انظر ذكاء ُمَعَّزز. .
Intelligence Explosion,طفرة الذكاء,فرضية تصف حالة يمكن فيها للآلات الفائقة الذكاء أن تنتج آلات أكثر ذكاء، يفوق ذكاؤها الذكاء البشري. ُيطلق عليها أيًضا تفُّرد تقني أو تفُّرد.   . .
Intelligent Agent )IA(,وكيل ذكي,كيان ذاتي التحكم يدرك بيئته ويقوم بأفعال لتحقيق أهداف محددة. .
Intelligent Automation,أتمتة ذكية,استخدام الذكاء الاصطناعي والتقنيات الأخرى ألداء المهام والعمليات دون تدخل بشري. .
Intelligent Control,تحكم ذكي,نوع من آليات التحكم التي تستخدم أساليب الذكاء الاصطناعي المختلفة لمحاكاة خصائص الذكاء البشري. .
Intelligent Document Processing )IDP(,معالجة ذكية للوثائق,أتمتة استخراج البيانات من المستندات المختلفة ومعالجتها وتحليلها باستخدام تقنيات الذكاء الاصطناعي. .
Intelligent Personal Assistant,مساعد شخصي ذكي,وكيل برمجيات يستخدم الذكاء الاصطناعي لمساعدة الأشخاص في المهام الأساسية. .
Intelligent Product,ُمنَتج ذكي,ُمنَتج يستخدم التقنية والبيانات والتحليالت لتحسين نفسه بصورة مستمرة وتقديم تجربة مستخدم أفضل. .
Intelligent Robot,روبوت ذكي,روبوت يمكنه تنفيذ المهام عن طريق استشعار محيطه، والتفاعل مع المصادر الخارجية، وتكييف سلوكه وفًقا لذلك. .
Inter-Annotator Agreement,اتفاق الُموِّصفين,انظر اتفاق الُمقِّيمين. .
Inter-Rater Agreement,اتفاق الُمقِّيمين,مقياس لحساب عدد المرات التي يتفق فيها المقِّيمون البشريون عند القيام بمهمة ما. وُيطلق عليه أيًضا اتفاق    . الُموِّصفين أو موثوقية الُمقِّيمين. .
Inter-Rater Reliability,موثوقية الُمقِّيمين,انظر اتفاق الُمقِّيمين. .
Internet of Things )IoT(,إنترنت الأشياء,شبكة من الأجهزة الإلكترونية والبرمجيات وأجهزة الاستشعار التي ُتتيح للآلات التفاعل مع بعضها. .
Internet of Things )IoT( Device,جهاز إنترنت الأشياء,جهاز استشعار أو ُمشِّغل في نظام إنترنت الأشياء يتفاعل مع العالم المادي. .
Interpretability,قابلية الشرح,انظر قابلية التفسير. .
Intersection over Union )IoU(,تقاطع على الاتحاد,مقياس لتحديد دقة مهام اكتشاف الأشياء أو الصور عن طريق مقارنة إطار التحديد المتوقع مع إطار التحديد الفعلي. .
